title,link,number_of_citation,article_type,publisher,publication_date,abstract,keyword
Collaborative duty cycling strategies in energy harvesting sensor networks,https://onlinelibrary.wiley.com/doi/10.1111/mice.12522,11,ORIGINAL ARTICLE,Wiley,2019,"Energy harvesting wireless sensor networks are a promising solution for low cost, long lasting civil monitoring applications. But management of energy consumption is a critical concern to ensure these systems provide maximal utility. Many common civil applications of these networks are fundamentally concerned with detecting and analyzing infrequently occurring events. To conserve energy in these situations, a subset of nodes in the network can assume active duty, listening for events of interest, while the remaining nodes enter low power sleep mode to conserve battery. However, judicious planning of the sequence of active node assignments is needed to ensure that as many nodes as possible can be reached upon the detection of an event, and that the system maintains capability in times of low energy harvesting capabilities. In this article, we propose a novel reinforcement learning (RL) agent, which acts as a centralized power manager for this system. We develop a comprehensive simulation environment to emulate the behavior of an energy harvesting sensor network, with consideration of spatially varying energy harvesting capabilities, and wireless connectivity. We then train the proposed RL agent to learn optimal node selection strategies through interaction with the simulation environment. The behavior and performance of these strategies are tested on real unseen solar energy data, to demonstrate the efficacy of the method. The deep RL agent is shown to outperform baseline approaches on both seen and unseen data.",none
Secured Routing Protocol for Improving the Energy Efficiency in WSN Applications,https://onlinelibrary.wiley.com/doi/10.1049/2024/6675822,none,Research Article,Wiley,2024,"A staggering number of applications rely on the network architecture to carry out their tasks, which has led to a fast growth in wireless sensor networks (WSN). The possibility of harmful activity and data theft is growing as a result of the growth in devices and data. Thus, the network’s regular users have an impact on legitimate data delivery, which lowers customer happiness and worsens network standards. The data have been saved using a variety of security procedures that have been developed in past research studies. However, harmful activity continues to engage in its illegal operations despite their efforts to safeguard data transmission in the network. As a result, a number of recent research projects have concentrated on predicting innovative techniques and processes to offer security in WSN. In comparison to existing methods, this work attempted to offer an effective tighter security for WSN and suggested an ML-Based Secured Routing Protocol (MLSRP) for WSN with improved energy efficiency and overall performance. Energy efficiency is the main requirement of WSNs, hence a clustered network is proposed where the data are routed through the cluster head nodes. In this paper, a multicriteria based decision-making (MCDM) model is used by the MLSRP to perform data routing, clustering, and cluster head election while also analyzing a number of network characteristics that might affect the quality of a node, route, and data. In NS2 software, the suggested framework is put into practice and simulated. The results are then validated to gauge performance. The observed quantitative results reveal that the proposed MLSRP method attains an improved network lifetime by 5% and network throughput of 6%. It reduces energy consumption by 40%, curtails overhead to 37%, and minimizes end-to-end delay by 30% than the other conventional methods. The suggested framework performs better than others when its total performance is compared to that of older methods.",none
"Underwater acoustic sensor networks: Taxonomy on applications, architectures, localization methods, deployment techniques, routing techniques, and threats: A systematic review",https://onlinelibrary.wiley.com/doi/10.1002/cpe.7815,none,RESEARCH ARTICLE,Wiley,2023,"Wireless information routing beneath the ocean, or usually underwater, has supplied the most excellent technical methods of oceanic observations. Traditionally, ocean bottoms have been monitored by placing oceanographic sensors that collect data at specific and defined ocean zones. When the duties are performed, the oceanographic instruments are recovered. Because there is no collaborative exchange of collected data between the collecting point and the monitoring end, data cannot be observed remotely. Underwater sensor networks can be wirelessly connected with sensors and monitors without extensive cable. Underwater wireless sensor networks are what they are called (UWSNs). This article investigates the various aspects of UWSNs, such as their significance, applications, network design, demands, routing, deployments and challenges.",none
Energy optimized artificial hummingbird algorithm for routing in IoT-based software-defined WSN,https://onlinelibrary.wiley.com/doi/10.1002/dac.5748,none,RESEARCH ARTICLE,Wiley,2024,"The Internet of Things (IoT) has become widely used in applications such as smart homes, industrial automation, and transportation due to its affordable hardware and fast internet connectivity. However, the increase in IoT-enabled gadgets, particularly those running on batteries or connected to other sources, is putting strain on the world's energy requirements. Therefore, this study focuses on a green routing solution for battery-powered IoT-enabled Software-defined Wireless Sensor Networks (IoT-SDWSN). Finding green solutions for IoT-based networks to address this energy challenge has become crucial. This study focuses on developing a green routing solution for battery-powered IoT-SDWSN. Energy efficiency in IoT-SDWSN is attained by the process of clustering nodes. The network is partitioned into small clusters, and a Control Node (CN) is set up by a Control Server (CS) to transmit the data packets sent by sensor nodes. Choosing a CN in these networks is a critical concern due to the substantial energy consumption involved in delivering data to the CS. This research focuses on the problem of energy-efficient cluster routing in IoT-based SD-WSN. It introduces the Energy-optimized Artificial Hummingbird Algorithm (EOAHA) as a green routing technique. EOAHA aims to extend the lifespan of IoT-based SD-WSNs by intelligently selecting (based on a new fitness function) CNs to distribute the network load and increase its overall longevity. To evaluate the performance of EOAHA, a comparative analysis is conducted against other state-of-the-art algorithms. The results demonstrate that EOAHA outperforms these algorithms by a minimum of 13.5% in terms of network longevity.",none
Energy aware optimal routing model for wireless multimedia sensor networks using modified Voronoi assisted prioritized double deep Q-learning,https://onlinelibrary.wiley.com/doi/10.1002/cpe.7945,none,RESEARCH ARTICLE,Wiley,2023,"The energy hole problem is critical in Wireless Multimedia Sensor Network (WMSN), wherein the nodes closer to the sink node will expire sooner than the outer sub-regions. Because they transmit their packet and forward the outer sub-regions packet to the sink. Hence, a hole arises near the sink node after a very short time. Thus, an energy-aware optimal routing model is introduced in this research using Modified Voronoi-assisted prioritized double deep Q-learning (PDDQL). Initially, the sensor nodes are deployed using the Voronoi cell structure that splits the entire region of interest into different Voronoi polygons. However, the Voronoi diagram will not always predict an efficient route because of the nodes at a Voronoi edge or vertex outside the transmission range. To tackle this issue, a new Voronoi diagram is proposed that depends on the maximum horizontal transmission range to remove the portion of Voronoi edges uncovered by the sensor node. After the deployment, a PDDQL algorithm is used to select the Relay Nodes based on their remaining energy. The proposed PDDQL determines an alternate route to transmit the packet if an energy hole problem has occurred in WMSN. The analysis of a proposed routing protocol based on the assessment measures like packet delivery ratio, average residual energy, number of alive nodes, and average end-to-end delay accomplished the value of 198.33 (ms), 2.05 (J), 100, and 0.85, respectively.",none
Link-delay and spectrum-availability aware routing in cognitive sensor networks,https://onlinelibrary.wiley.com/doi/10.1049/iet-com.2019.0994,4,Research Article,Wiley,2020,"This study designs and presents routing protocols multi-channel, multi-hop cognitive radio sensor network (CRSN), which are based on spectrum sensing, spectrum-availability analysis and per-hop delay analysis. In order to cope with the spectrum dynamics in the CRSNs, a framework is proposed to estimate the remaining duration of spectrum availability which is based on the expected idle length of channels, sensing period and communication history on the channel. Such methodology allows cognitive users to mitigate communication interruptions caused by arrivals of primary users, thus to improve the transmission performance over each hop. In particular, in combination with the per-hop delay analysis, the routing paths from sources to the sink can be established such as they provide the shortest delay opportunistically or shorter delay but reliable communication along the selected paths. Extensive simulation results show that the proposed routing algorithms potentially improve the network performances in terms of throughput, delay and energy consumption.",none
A Systematic Review of Localization in WSN: Machine Learning and Optimization-Based approaches,https://onlinelibrary.wiley.com/doi/10.1002/dac.5397,2,RESEARCH ARTICLE,Wiley,2022,"In recent years, wireless sensor networks (WSNs) have been widely used in various applications. The localization problem has been identified as one of the biggest problems faced by WSNs. The traditional localization techniques may not be able to handle the issues during the scenario to estimate the location of sensor nodes due to anchor mobility, mobile WSNs, latency, energy harvesting, unfavorable environmental states, and many more issues. However, these issues open the door for the amalgamation of machine learning (ML) and optimization techniques with localization techniques. Motivated by the earlier discussion, we explored various ML and optimization techniques to estimate the location coordinates in a sensor network in this paper. Finally, a comparison of existing ML algorithms concerning optimization techniques has been presented, highlighting their improved outcomes. This research offers a detailed survey by exploring the various parameters for location estimation through tabular forms by incorporating ML and optimized localization techniques. A survey of surveys is also presented to identify the key limitations of existing surveys and to introduce the novelty in the comprehensive study done in this paper. A year-wise evaluation of ML Techniques with localization (2011–2022) is also discussed and presented over various performance parameters, including energy-efficiency, accuracy, error, and complexity. This discussion concluded that Hybrid Techniques are least explored for using optimized localization machine learning. Further, a summarized discussion of the various comparison tables paves the path for future research in the area of localization in WSN.",none
An enhanced MSU-TSCH scheduling algorithms for industrial wireless sensor networks,https://onlinelibrary.wiley.com/doi/10.1002/cpe.7938,none,RESEARCH ARTICLE,Wiley,2023,"The reliability and latency requirements of wireless sensor network-based smart grid communications are met in large part by MAC protocols. Developed by IEEE, time slotted channel hopping (TSCH), a method that is effective, dependable, and predictable. However, the TSCH standard does not enable mobility and does not offer any solution for scheduling, especially in IEEE 802.15.4 TSCH, the most recent generation of extremely dependable and low-power MAC protocols. Recently, MSU-TSCH a time-frequency communication schedule was proposed to provide mobility to TSCH. Despite its distinctive qualities, MSU-TSCH has the drawback of computing the TSCH schedule at each node independently of its traffic load, which can significantly increase the communication delay. Due to this limitation, MSU-TSCH is not suitable for some delay-sensitive smart grid applications. In this article, we provide an improved MSU-TSCH-based TSCH protocol, called Mobility-TSCH, that dynamically adjusts time slot assignments based on traffic volume and latency requirement. Moreover, the protocol Mobility-TSCH adapts to topology changes and supports mobility. Additionally, it optimizes time slot allocation by prioritizing nodes closest to the sink. The performance and evaluation analysis of Mobility-TSCH compared to the original MSU-TSCH, reveal that the communication delay is greatly reduced, decreases the average end-to-end latency, the high packet delivery ratio (PDR), Increase the performance of both metrics, parent connectivity ratio (PCR) and convergence time (CT), while maintaining a minimal overhead signaling.",none
QoS-enabled resource allocation algorithm in internet of vehicles with mobile edge computing,https://onlinelibrary.wiley.com/doi/10.1049/iet-com.2019.0981,12,Research Article,Wiley,2020,"Along with the development of 5G technology in mobile sensing and wireless communication, the internet of vehicles (IoV) has drawn much attention from the research community. The traditional centralised cloud-based IoV network has become a bottleneck in providing computation-intensive, high-mobility and low-latency services. As a promising computing paradigm, mobile edge computing (MEC) addresses such challenges. In this study, the authors propose a hierarchical IoV system, combined with MEC. They then focus on the problem of quality of service (QoS)-enabled resource allocation for computing tasks in the system. However, the existing studies often fail to take into account different delay tolerances between different task types. In order to optimise the completion delay, they design an approach to classify tasks into different priorities according to their delay tolerances and then reorder tasks. After reordering, they use a reinforcement learning algorithm to allocate resources automatically and intelligently. Simulation results confirm that the proposed scheme is feasible and effective in the aspects of time efficiency and outage probability.",none
FQ-MEC: Fuzzy-Based Q-Learning Approach for Mobility-Aware Energy-Efficient Clustering in MANET,https://onlinelibrary.wiley.com/doi/10.1155/2021/8874632,2,Research Article,Wiley,2021,"Different schemes have been proposed for increasing network lifetime in mobile ad hoc networks (MANETs) where nodes move uncertainly in any direction. Mobility awareness and energy efficiency are two inescapable optimization problems in such networks. Clustering is an important technique to improve scalability and network lifetime, as it relies on grouping mobile nodes into logical subgroups, called clusters, to facilitate network management. One of the challenging issues in this domain is to design a real-time routing protocol that efficiently prolongs the network lifetime in MANET. In this paper, a novel fuzzy-based Q-learning approach for mobility-aware energy-efficient clustering (FQMEC) is proposed that relies on deciding the behavioral pattern of the nodes based on their stability and residual energy. Also, Chebyshev’s inequality principle is applied to get node connectivity for load balancing by taking history from the monitoring phase to increase the learning accuracy. Extensive simulations are performed using the NS-2 network simulator, and the proposed scheme is compared with reinforcement learning (RL). The obtained results show the effectiveness of the proposed protocol regarding network lifetime, packet delivery ratio, average end-to-end delay, and energy consumption.",none
Traffic and Energy Aware Optimization for Congestion Control in Next Generation Wireless Sensor Networks,https://onlinelibrary.wiley.com/doi/10.1155/2021/5575802,23,Research Article,Wiley,2021,"Congestion in wireless sensor networks (WSNs) is an unavoidable issue in today’s scenario, where data traffic increased to its aggregated capacity of the channel. The consequence of this turns in to overflowing of the buffer at each receiving sensor nodes which ultimately drops the packets, reduces the packet delivery ratio, and degrades throughput of the network, since retransmission of every unacknowledged packet is not an optimized solution in terms of energy for resource-restricted sensor nodes. Routing is one of the most preferred approaches for minimizing the energy consumption of nodes and enhancing the throughput in WSNs, since the routing problem has been proved to be an NP-hard and it has been realized that a heuristic-based approach provides better performance than their traditional counterparts. To tackle all the mentioned issues, this paper proposes an efficient congestion avoidance approach using Huffman coding algorithm and ant colony optimization (ECA-HA) to improve the network performance. This approach is a combination of traffic-oriented and resource-oriented optimization. Specially, ant colony optimization has been employed to find multiple congestion-free alternate paths. The forward ant constructs multiple congestion-free paths from source to sink node, and backward ant ensures about the successful creation of paths moving from sink to source node, considering energy of the link, packet loss rate, and congestion level. Huffman coding considers the packet loss rate on different alternate paths discovered by ant colony optimization for selection of an optimal path. Finally, the simulation result presents that the proposed approach outperforms the state of the art approaches in terms of average energy consumption, delay, and throughput and packet delivery ratio.",none
Network statistics-based routing and path orient data encryption scheme for efficient healthcare monitoring with IoT in WSN,https://onlinelibrary.wiley.com/doi/10.1002/dac.5361,1,RESEARCH ARTICLE,Wiley,2022,"Wireless communication has been adapted for a variety of difficulties as a result of recent developments in sensor networks. The sensors are meant to communicate with network nodes located at a distance and to adapt to various conditions. In addition, Internet of Things (IoT) devices are becoming a part of WSN and are being tailored to various healthcare systems. Nonetheless, the presence of massive nodes and rogue nodes makes transmitting data packets difficult. The procedure, however, confronts a number of obstacles, including data security, continuous monitoring, and routing issues. A variety of ideas are explored to help with the situation, but they all have flaws. A network statistics-based routing and path orient data encryption system has been developed to address this problem (NSR-PDE). The strategy focuses on keeping track on patients and providing strong, decisive support systems. The model is created to access data stored on cloud servers and allows for the monitoring of multiple patients in different locations. The model begins by monitoring the whole bodily states of patients in real time using dedicated equipment. Such monitored characteristics are provided over a variety of channels, with route selection based on the patient's class and the type of information being transmitted. The approach calculates the network constraint secure route measure (NCSRM), which is calculated using route information, node behavior, and physical attributes. Similarly, data transmission is protected by path orient data encryption (PDE), which ensures data security according on the route's type and conditions.",none
Anomaly detection in autonomous electric vehicles using AI techniques: A comprehensive survey,https://onlinelibrary.wiley.com/doi/10.1111/exsy.12754,8,SURVEY ARTICLE,Wiley,2021,"The next wave in smart transportation is directed towards the design of renewable energy sources that can fuel automobile sector to shift towards the autonomous electric vehicles (AEVs). AEVs are sensor-driven and driverless that uses artificial intelligence (AI)-based interactions in Internet-of-vehicles (IoV) ecosystems. AEVs can reduce carbon footprints and trade energy with peer AEVs, smart grids (SG), and roadside units (RSUs). It supports green transportation vision. However, the sensor information, energy units, and user data are exchanged through open channels, and thus, are susceptible to various security and privacy attacks. Thus, AEVs can be remotely operated and directed by malicious entities that can propagate false updates to the peer nodes in IoV environment. This can cause the failure of components, congestion, as well as the entire disruption of IoV network. Globally researchers and security analysts have addressed solutions that pertain to specific security requirements, but still, the detection and classification of malicious AEVs is a widely studied topic. Malicious AEVs exhibit an anomaly behavior that differentiates them from normal AEVs, and thereby, the detection of anomalous AEVs and classification of anomaly type is required. Motivated from the aforementioned facts, the survey presents a systematic outlook of AI techniques in anomaly detection of AEVs. A solution taxonomy is proposed based on research gaps in the existing surveys, and the evaluation metrics for AI-based anomaly detection are discussed. The open challenges and issues in AI deployments are discussed and a case study is presented on anomaly classification through a weighted ensemble technique. Thus, the proposed survey is designed to guide the manufacturing industry, AI practitioners, and researchers worldwide to formulate and design accurate and precise mechanisms to detect anomalies.",none
"An overview of Internet of Things (IoT): Architectural aspects, challenges, and protocols",https://onlinelibrary.wiley.com/doi/10.1002/cpe.4946,266,SPECIAL ISSUE PAPER,Wiley,2018,"Understanding of any computing environment requires familiarity with its underlying technologies. Internet of Things (IoT), being a new era of computing in the digital world, aims for the development of large number of smart devices that would support a variety of applications and services. These devices are resource-constrained, and the services they would provide are going to impose specific requirements, among which security is the most prominent one. Therefore, in order to comprehend and conform these requirements, there is a need to illuminate the underlying architecture of IoT and its associated elements. This comprehensive survey focuses on the security architecture of IoT and provides a detailed taxonomy of major challenges associated with the field and the key technologies, including Radio Frequency Identification (RFID) and Wireless Sensor Networks (WSN), that are enabling factors in the development of IoT. The paper also discusses some of the protocols suitable for IoT infrastructure and open source tools and platforms for its development. Finally, a brief outline of major open issues, along with their potential solutions and future research directions, is given.",none
Recent trends and advances in machine learning challenges and applications for industry 4.0,https://onlinelibrary.wiley.com/doi/10.1111/exsy.13506,none,EDITORIAL,Wiley,2023,"This editorial summarizes and analyzes 17 articles selected for a special issue on machine learning advances for Industry 4.0 applications. The diverse articles cover fault detection, deep learning optimisation, IoT networking, vehicle control, recommendation systems and domain knowledge integration. Key methods represented include neural networks, deep learning, reinforcement learning and explainable AI. Real-world industrial case studies showcase machine learning's versatility in enabling intelligent automation, control, and decision-making across manufacturing, healthcare, transportation and other sectors. While highlighting theoretical innovations, the contributions also demonstrate machine learning's transformative potential for intelligent, connected, self-optimising next generation production systems. This editorial concisely overviews the latest trends represented in this special issue.",none
