title,link,number_of_citation,article_type,publisher,publication_date,abstract,keyword
Survey of Connectivity Restoration in 3D Wireless Ad Hoc/Sensor Networks,https://onlinelibrary.wiley.com/doi/10.1155/2024/6656884,none,Review Article,Wiley,2024,"Wireless ad hoc/sensor networks (WASN) have seen increased application in three-dimensional (3D) environments, such as underwater and aerial scenarios. However, WASN may be fragmented or unable to connect continuously due to the harsh surrounding environment or high mobility. Therefore, restoring the network connectivity and transmit data in real time is very important. This paper focuses on the critical task of restoring network connectivity in 3D WASN, a complex issue given that existing connectivity restoration algorithms for two-dimensional environments are not directly applicable or become overly complicated in 3D contexts. We present a comprehensive analysis of the current research landscape, summarizing key findings related to various aspects of 3D WASN connectivity restoration. These aspects include the application environment (underwater, in the sky, and recovery disaster), opportunities for restoration (active, passive, and active/passive), implementation strategies (clustering and sleep scheduling), and resource constraints (node deployment and movement control). Our study also proposes a classification of connectivity restoration solutions for 3D WASN, identifying existing gaps and suggesting potential future research directions. By providing specific insights and a structured overview of the field, we aim to contribute to the ongoing development of robust and resilient 3D WASN.",none
Hybrid localization scheme using K-fold optimization with machine learning in WSN,https://onlinelibrary.wiley.com/doi/10.1002/dac.5206,5,RESEARCH ARTICLE,Wiley,2022,"Node localization technology can identify and track nodes, making observing data more relevant; for example, information received at the sink node would be useless to the client if node localization data from the sensor region were not included. Localization is described as determining the location of unknown sensor nodes named destination nodes applying the recognized location of anchor nodes based on measurements such as time difference of occurrence, time of occurrence, angle of occurrence, triangulation, and maximum probability. The purpose of node localization is to assign coordinates points to all sensor nodes arbitrarily put in the monitoring region and have an unknown location. Localization of nodes is essential to account for the cause of events that help group sensor querying, routing, and network coverage. In this paper, data transmission among the nodes is done by comparing the received signal strength indicator (RSSI) value with the supervised learning value. If the RSSI value is less than the supervised learning value, the data transmission takes place; else, no transmission. This paper proposes a hybrid localization scheme that effectively uses K-fold optimization with supervised learning and gives good results for distance error and RSSI/energy efficiency. The proposed scheme can effectively detect the optimal path for data transmission, node localization for the destination, and overall performance enhancement using threshold decision making.",none
Localization and Detection of Multiple Attacks in Wireless Sensor Networks Using Artificial Neural Network,https://onlinelibrary.wiley.com/doi/10.1155/2023/2744706,11,Research Article,Wiley,2023,"Security enhancement in wireless sensor networks (WSNs) is significant in different applications. The advancement of routing attack localization is a crucial security research scenario. Various routing attacks degrade the network performance by injecting malicious nodes into wireless sensor networks. Sybil attacks are the most prominent ones generating false nodes similar to the station node. This paper proposed detection and localization against multiple attacks using security localization based on an optimized multilayer perceptron artificial neural network (MLPANN). The proposed scheme has two major part localization techniques and machine learning techniques for detection and localization WSN DoS attacks. The proposed system is implemented using MATLAB simulation and processed with the IBM SPSS toolbox and Python. The dataset is classified into training and testing using the multilayer perceptron artificial neural network to detect ten classes of attacks, including denial-of-service (DoS) attacks. Using the UNSW-NB, WSN-DS, NSL-KDD, and CICIDS2018 benchmark datasets, the results reveal that the suggested system improved with an average detection accuracy of 100%, 99.65%, 98.95%, and 99.83% for various DoS attacks. In terms of localization precision, recall, accuracy, and f-score, the suggested system outperforms state-of-the-art alternatives. Finally, simulations are done to assess how well the suggested method for detecting and localizing harmful nodes performs in terms of security. This method provides a close approximation of the unknown node position with low localization error. The simulation findings show that the proposed system is effective for the detection and secure localization of malicious attacks for scalable and hierarchically distributed wireless sensor networks. This achieved a maximum localization error of 0.49% and average localization accuracy of 99.51% using a secure and scalable design and planning approach.",none
Distributed fast channel allocation in cognitive wireless sensor networks,https://onlinelibrary.wiley.com/doi/10.1049/iet-spr.2015.0481,2,Research Article,Wiley,2016,"For the feature of zero delay in continuous relay transmission, wireless sensor networks (WSNs) supporting multiple communication interfaces is much suitable for data collection and transmission backbone network of coal mine safety monitor and control system which has high demand of reliability in real-time data transmission. Based on in-depth analysis of the existing distributed channel allocation algorithms, this study proposes an innovative fast distributed channel allocation scheme based on largest edges of network topology (CALENT) with the combination of wireless network architecture features. By comparing with existing distributed channel allocation dis-link algorithm, CALENT has better performance in co-channel interference index and convergence velocity.",none
Social sensing-based duty cycle management for monitoring rare events in wireless sensor networks,https://onlinelibrary.wiley.com/doi/10.1049/iet-wss.2013.0125,6,Research Articles,Wiley,2015,"This paper introduces a social sensing-based dynamic duty cycle management scheme, namely probabilistic duty cycle in sensor medium access control (PDC-SMAC) protocol, for wireless sensor networks (WSNs). The objective of PDC-SMAC is to minimise energy consumption in monitoring ‘rare events’ by reducing the period of ‘ineffective sensing’. Ineffective sensing is defined as event monitoring or sensing, even if there is no event to monitor or sense. Existing schemes suffer from unnecessary energy consumption because of ineffective sensing. For example, the period and frequency of occurrence of an event in military applications is unpredictable, and sometimes the delay between two consecutive occurrences is very large. We exploit the social sensing behaviour of social networks for avoiding ineffective sensing by managing the duty cycle of a node in a sensor network. PDC-SMAC minimises the energy consumption of a WSN as the event monitoring overhead is accounted for by the social network. Simulation results show that PDC-SMAC consumes 37% less energy in an ideal environment and 15% less energy on overall performances as compared with the benchmark considered for comparison. It minimises message delivery latency by 27 − 60% for different packet generation intervals and by 47% for different event occurrence rates, compared with the benchmark.",none
IoT based thermal aware routing protocols in wireless body area networks: Survey: IoT based thermal aware routing in WBAN,https://onlinelibrary.wiley.com/doi/10.1049/cmu2.12438,7,REVIEW,Wiley,2022,"The growth of the world's population, especially that of the elderly, along with the outbreak of infectious diseases such as COVID-19 have caused hospitals and healthcare centres to become full, and even economical treatments cost a lot. On that account, the conjunction of wireless body area networks (WBAN) and Internet of Things (IoT) for healthcare and medical diagnosis has become really important, and is accordingly one of the most popular and attractive areas of the Internet of Things (IoT). In such an IoT, a wireless body area network (WBAN) consists of a miniature sample of the Internet of Medical Things (IoMT) that can be either implanted in the human body or wearable. Nowadays, IoT has made healthcare evaluation possible. Instead of the patient being constantly hospitalized for treatment, the condition of the person is sent to the health centre by the IoMT over the Internet. IoT enables wireless communication between smart devices on one side and almost anything on the other. Since this network deals with medical and critical conditions, data must be sent to a physician or practitioner in the prescribed period; this indicates that routing is one of the most critical issues. Thus, routing is considered a very important challenge in WBANs. The present study describes thermal (temperature)-aware routing protocols in WBANs. Routing protocols in WBANs are divided into thermal (temperature)-aware, QoS-aware, security-aware, cluster-based, cross-layered, postured-based, cost-effect, link-aware, and opportunistic ones. In a WBAN, temperature rise in implant nodes can damage body tissues, which is dangerous for the patient. Accordingly, here, those algorithms were considered which are presented in thermal (temperature)-aware protocols. This paper first introduces IoT-based WBANs, their routing mechanism and challenges, after which it provides a detailed description of thermal (temperature)-aware algorithms. Finally, the advantages and disadvantages of these algorithms are presented.",none
Overview of evolutionary algorithms and neural networks for modern mobile communication,https://onlinelibrary.wiley.com/doi/10.1002/ett.4579,none,SURVEY ARTICLE,Wiley,2022,"The sixth generation (6G) of mobile networks must support the huge growth of mobile connections and provides various intelligent services in future mobile networks. For that, designing high-performance network architecture and communication systems (CSs) as well as finding coherent solutions for the determined problems is critical demand that needs to be achieved in 6G networks. Optimal solutions are mainly sought by using modifiable, smart, and perceptive algorithms aimed at optimizing more specific tasks. Therefore, advanced optimization methods are highly required to accommodate the requirements of CSs efficiently. That will be in various parts of the future networks such as advanced mobility management, multi communication links, efficient power consumption, ultra-lower latency, ultra-security, high speed, and reliable connectivity. Accordingly, highly accurate and smart functions must be modeled to optimize the required communication parameters in the network. This study provides a comprehensive overview of optimization methods that may need further investigations and developments to be applied in 6G networks at various parts of networks. A detailed theoretical description for each method is presented and discussed to elucidate future research directions for optimizing specific characteristics with multi-objective optimizations. Moreover, this article illustrates the conceptual and structural viewpoints of reported optimization methods. Also, the capability of various optimization methods that can offer industrial solutions in 6G is discussed. The potential applications of each method are also analyzed. Finally, this article presented the research issues and future directions of optimization technology and research gaps that need to be addressed before the standardization of 6G networks.",none
Distributed Image Compression Architecture over Wireless Multimedia Sensor Networks,https://onlinelibrary.wiley.com/doi/10.1155/2017/5471721,22,Research Article,Wiley,2017,"In a wireless multimedia sensor network (WMSN), the minimization of network energy consumption is a crucial task not just for scalar data but also for multimedia. In this network, a camera node (CN) captures images and transmits them to a base station (BS). Several sensor nodes (SNs) are also placed throughout the network to facilitate the proper functioning of the network. Transmitting an image requires a large amount of energy due to the image size and distance; however, SNs are resource constrained. Image compression is used to scale down image size; however, it is accompanied by a computational complexity trade-off. Moreover, direct image transmission to a BS requires more energy. Thus, in this paper, we present a distributed image compression architecture over WMSN for prolonging the overall network lifetime (at high throughput). Our scheme consists of three subtasks: determining the optimal camera radius for prolonging the CN lifetime, distributing image compression tasks among the potential SNs to balance the energy, and, finally, adopting a multihop hierarchical routing scheme to reduce the long-distance transmission energy. Simulation results show that our scheme can prolong the overall network lifetime and achieve high throughput, in comparison with a traditional routing scheme and its state-of-the-art variants.",none
Machine Learning Technologies for Secure Vehicular Communication in Internet of Vehicles: Recent Advances and Applications,https://onlinelibrary.wiley.com/doi/10.1155/2021/8868355,85,Review Article,Wiley,2021,"Recently, interest in Internet of Vehicles’ (IoV) technologies has significantly emerged due to the substantial development in the smart automobile industries. Internet of Vehicles’ technology enables vehicles to communicate with public networks and interact with the surrounding environment. It also allows vehicles to exchange and collect information about other vehicles and roads. IoV is introduced to enhance road users’ experience by reducing road congestion, improving traffic management, and ensuring the road safety. The promised applications of smart vehicles and IoV systems face many challenges, such as big data collection in IoV and distribution to attractive vehicles and humans. Another challenge is achieving fast and efficient communication between many different vehicles and smart devices called Vehicle-to-Everything (V2X). One of the vital questions that the researchers need to address is how to effectively handle the privacy of large groups of data and vehicles in IoV systems. Artificial Intelligence technology offers many smart solutions that may help IoV networks address all these questions and issues. Machine learning (ML) is one of the highest efficient AI tools that have been extensively used to resolve all mentioned problematic issues. For example, ML can be used to avoid road accidents by analyzing the driving behavior and environment by sensing data of the surrounding environment. Machine learning mechanisms are characterized by the time change and are critical to channel modeling in-vehicle network scenarios. This paper aims to provide theoretical foundations for machine learning and the leading models and algorithms to resolve IoV applications’ challenges. This paper has conducted a critical review with analytical modeling for offloading mobile edge-computing decisions based on machine learning and Deep Reinforcement Learning (DRL) approaches for the Internet of Vehicles (IoV). The paper has assumed a Secure IoV edge-computing offloading model with various data processing and traffic flow. The proposed analytical model considers the Markov decision process (MDP) and ML in offloading the decision process of different task flows of the IoV network control cycle. In the paper, we focused on buffer and energy aware in ML-enabled Quality of Experience (QoE) optimization, where many recent related research and methods were analyzed, compared, and discussed. The IoV edge computing and fog-based identity authentication and security mechanism were presented as well. Finally, future directions and potential solutions for secure ML IoV and V2X were highlighted.",none
Toward Performant and Energy-Efficient Network Queries: A Parallel and Stateless Approach,https://onlinelibrary.wiley.com/doi/10.1155/2023/6185758,none,Research Article,Wiley,2023,"In many edge computing applications (e.g., wireless sensor networks, WSNs) where nodes are mostly battery-powered, queries’ energy consumption, and response time are two of the most important metrics, representing the network’s sustainability and performance, respectively. Conventional techniques used to focus on only one of the two metrics and did not attempt to optimize both in a coordinated manner. This work aims to achieve both high sustainability and high performance of these queries at the same time. To that end, a new mechanism is proposed to construct the topology of a three-tier WSN. The proposed mechanism eliminates the conventional stateful routing tables and employs a stateless and efficient addressing scheme inspired by the Chinese remainder theorem (CRT). The CRT-based topology allows for query parallelism, an unprecedented feature in the WSNs. On top of the new topology encoded by CRT, a new protocol is designed to parallelly preprocess collected data on sensor nodes by effectively aggregating and deduplicating data in a cluster of neighborhood nodes. At the same time, the hibernating mechanism is proposed to prolong the network life cycle. Moreover, a new algorithm is devised to allow the queries and results to be transmitted through low-power and fault-tolerant paths using recursive elections over a subset of the entire power range. With all these new techniques taken together, the system presented in this work outperforms approximate algorithms from various perspectives: (i) the query response is improved by up to 21.6%; (ii) the energy consumption is reduced by up to 16.8%; and (iii) the reliability is increased by up to 18.3%.",none
Routing in Wireless Multimedia Sensor Networks: A Survey of Existing Protocols and Open Research Issues,https://onlinelibrary.wiley.com/doi/10.1155/2016/9608757,28,Review Article,Wiley,2016,"With the advancement of wireless sensor networks (WSNs) and technology, applicability of WSNs as a system is touching new heights. The development of multimedia nodes has led to the creation of another intelligent distributed system, which can transfer real-time multimedia traffic, ubiquitously. Wireless multimedia sensor networks (WMSNs) are applicable in a wide range of areas including area monitoring and video surveillance. But due to unreliable error-prone communication medium and application specific quality of service (QoS) requirements, routing of real-time multimedia traffic in WMSNs poses a serious problem. The paper discusses various existing routing strategies in WMSNs, with their properties and limitations which lead to open research issues. Further, detailed classification and analytical comparison of discussed protocols are also presented.",none
Selection of Optimal Deployment and Routing Configurations in Underwater Acoustic Sensor Networks for Avoiding Energy Holes,https://onlinelibrary.wiley.com/doi/10.1155/2019/3597304,3,Research Article,Wiley,2019,"Improving the energy efficiency of underwater acoustic sensor networks (UW-ASNs) is a crucial issue due to the reduced and nonrechargeable energy resource of the underwater sensor nodes. In this work, we address the energy sink hole problem in UW-ASNs while considering the unique and harsh characteristics of the underwater channel. Our goal is to determine the optimal deployment and routing settings that surmount the energy sink hole problem and hence maximize the network lifetime. We prove that sensors can evenly consume their initial battery power provided that first they adjust their transmission power when they transmit the route through traffic and second they are appropriately placed while deployed. Mainly, we propose a deployment scheme and the corresponding balanced routing strategy that lead to uniform energy consumption among all underwater sensors subject to a predefined reliability level at the sink. Specifically, we look for the optimal deployment settings especially in terms of nodes’ separation distances that help achieving uniform energy consumption in the network while satisfying the application requirement especially in terms of desired information reliability. Jointly, at the routing layer, we assume that each sensor is provided with the possibility of dynamically adjusting its transmission power up to a given number of levels N. To this goal, we mainly deal with two main cases: fixed and variable nodes separation distance. For the fixed case, we suppose that any two successive nodes in the network are equally spaced, and we strive for deriving the optimal distance as well as the optimal number of transmission power levels along with optimal load weight corresponding to every possible transmission power level for every sensor node. For the variable case, we deal with two subcases: first, we suppose that the distance separating successive nodes follows an arithmetic progression, and second, we assume that the distance separating successive nodes is following a geometric sequence. Note that for both cases, namely, fixed and variable, we succeed to determine the optimal distances separating successive nodes and the optimal number N of transmission power levels along with the corresponding optimal load weight that overcome the energy holes problem, and hence the network lifespan is maximized while respecting the desired reliability level.",none
Survey of data aggregation techniques using soft computing in wireless sensor networks,https://onlinelibrary.wiley.com/doi/10.1049/iet-ifs.2012.0292,44,Article,Wiley,2013,"In wireless sensor networks (WSN), data aggregation using soft computing methods is a challenging issue because of the security factors. When a node is compromised, it is easy for an adversary to inject false data and mislead the aggregator to accept false readings. Therefore there is a need for secure data aggregation. Although sufficient works on the survey of data aggregation in WSNs are done, it seems less satisfactory in terms of maintaining a secured data aggregation, and measuring accurate values. This study presents an up to date survey of major contributions to the security solutions in data aggregation which mainly use soft computing techniques. Here, classification of protocols is done according to the soft computing technique as: fuzzy logic, swarm intelligence, genetic algorithm and neural networks. Accuracy, energy consumption, cost reduction and security measures are the metrics used for the classification. Finally, the authors provide a comparative study of all aggregation techniques.",none
A Hybrid Approach to Maximize Lifetime in Connected Directional Sensor Networks with Adjustable Sensing Ranges,https://onlinelibrary.wiley.com/doi/10.1049/cje.2017.11.014,3,Article,Wiley,2018,"A directional sensor network consists of numerous small sensor nodes that have limited battery power and operate within a restricted sensing range angle. Coverage and connectivity, as two important issues, are widely studied in directional sensor networks. Different from conventional directional sensor nodes in previous studies, those in the present study could adjust their sensing ranges within a range of several values. This paper addresses the Connected adjusted-ranges directional cover (CARDC) problem. The purpose is to organize the directional sensor nodes into a group of connected covers, and assign activities to them, thereby maximizing the network lifetime. We propose a hybrid approach that combines column generation with a genetic algorithm to solve the CARDC problem. The genetic algorithm is utilized to settle the auxiliary problem of column generation, which has the ability to efficiently provide attractive columns for the master problem. Compared with pure integer linear programming formulations, the proposed genetic algorithm significantly improves the speed of column generation method, especially in large-scale networks. The effect variety of number of directions, number of power levels, and communication range on the network lifetime are also investigated.",none
