title,link,number_of_citation,article_type,publisher,publication_date,abstract,keyword
Energy-Efficient IoT with Deep Learning: Optimizing Resource Allocation in Smart Grids,https://ieeexplore.ieee.org/document/10407067/,4,Conference Paper,IEEE,2023,"The integration of Internet of Things (IoT) technology with deep reinforcement learning (DRL) has emerged as a transformative approach in the realm of smart grid management. This abstract explores the intersection of these two domains, focusing on their collective potential to enhance energy efficiency through optimized resource allocation in smart grids. Smart grids represent a pivotal innovation in the modern energy landscape, offering a dynamic platform for the integration of renewable energy sources, efficient load management, and real-time grid monitoring. However, the complex and ever-changing nature of smart grids poses challenges in effectively allocating energy resources to meet diverse consumer demands while minimizing waste. Deep reinforcement learning, a subset of artificial intelligence, harnesses the power of IoT-connected devices and sensors to create adaptive, data-driven resource allocation strategies. The adaptability of DRL models to evolving grid conditions and consumer preferences enables dynamic resource allocation. This adaptability leads to more efficient energy resource utilization, waste reduction, and operational cost savings. Beyond cost benefits, energy-efficient resource allocation contributes significantly to sustainability objectives and grid resilience. The method consistently achieves the highest network throughput, ranging from 2700 units with 100 sensors to 2300 units with 500 sensors.Our model sheds light on the promising synergy between IoT technology and deep reinforcement learning for the purpose of resource allocation optimization in smart grids. The resulting improvements in energy efficiency promise economic advantages while simultaneously advancing environmental sustainability goals.","Deep Learning ,  Resource Allocation ,  Internet Of Things ,  Smart Grid ,  Optimal Resource Allocation ,  Energy-efficient Internet Of Things ,  Energy Source ,  Energy Efficiency ,  E-learning ,  Deep Reinforcement Learning ,  Network Throughput ,  Internet Of Things Technology ,  Neural Network ,  Machine Learning ,  Data Management ,  Data Transmission ,  Global Positioning System ,  Internet Of Things Devices ,  Energy Usage ,  Wireless Sensor Networks ,  Cache Hit ,  Internet Of Things Sensors ,  Sink Node ,  Smart Meters ,  Smart Sensors ,  Content Popularity ,  Internet Of Vehicles ,  Edge Devices ,  Routing Decisions ,  Energy Meter "
Intelligent Parent Change to Improve 6TiSCH Network Transmission Using Multi-Agent Q-Learning,https://ieeexplore.ieee.org/document/10609377/,0,Journal Article,IEEE,2024,"The 6TiSCH (IPv6 over the TSCH mode of IEEE 802.15.4e) architecture for wireless sensor networks merges the time-slotted channel hopping (TSCH) at the medium access control (MAC) layer with the routing protocols tailored for low-power and lossy networks (RPL). However, research often neglects the incorporation between TSCH MAC and RPL. Standard RPL strategies rely on an objective function (OF) using the expected transmission count (ETX) metric, which does not adequately reflect the traffic dynamics. Moreover, RPL’s hysteresis function employs a static threshold to control parent change decisions. This static setting disregarded the diverse traffic patterns within the network, leading to unnecessary parent node changes and preventing the node from selecting a better parent. To overcome these shortcomings, we introduce 3 advancements to standard RPL. First, an adaptive parent-changing mechanism based on cooperative Q-learning. Second, a cell usage and traffic load aware objective function. Third, an improved initial transmission cell allocation. Those methods are collectively termed ACI-RPL. We evaluated the performance of the proposed method through simulations using the 6TiSCH simulator and real-hardware tests on the FIT IoT-Lab testbed with OpenWSN firmware. The experiment result indicates that ACI-RPL performs better than the benchmark algorithms. In comparison to the standard RPL, ACI-RPL improves the packet delivery ratio and the total received packets by 12% and 17%, respectively. Additionally, ACI-RPL reduces energy consumption and latency by 23% and 9%.","6TiSCH Network ,  Energy Consumption ,  Objective Function ,  Root Node ,  Wireless Sensor Networks ,  Traffic Load ,  Benchmark Algorithms ,  Medium Access Control ,  Medium Access ,  Medium Access Control Layer ,  Packet Delivery Ratio ,  Static Threshold ,  High Use ,  Changes In Frequency ,  Internet Of Things ,  Network Size ,  Traffic Conditions ,  Markov Decision Process ,  Directed Acyclic Graph ,  Child Nodes ,  Quality Of Transmission ,  Packet Transmission ,  Control Packets ,  Packet Drop ,  Candidate Parents ,  Multi-agent Reinforcement Learning ,  Selection Of Parents ,  Hop Count ,  Comprehensive Metrics ,  Traffic Rate "
Deep Reinforcement Learning for Modulation and Coding Scheme Selection in Cognitive HetNets,https://ieeexplore.ieee.org/document/8761663/,6,Conference Paper,IEEE,2019,"We study a cognitive heterogeneous network (HetNet), in which multiple pairs of secondary users coexist with a pair of primary users on a certain spectrum band. To protect primary transmissions, secondary transmitters (STs) adopt a sensing-based approach to access the spectrum band. Nevertheless, STs may cause uncertain interference to the primary receiver (PR) due to imperfect spectrum sensing, which is particularly significant when the wireless links between the primary transmitter (PT) and STs are extremely weak and the wireless links between STs and the PR are non-ignorable. This makes it difficult for the PR to select a proper modulation and/or coding scheme (MCS). To deal with the issue, we propose an intelligent deep reinforcement learning (DRL) based MCS selection algorithm for the primary transmission. With the proposed algorithm, the DRL agent at the PR is able to learn the pattern of the interference from the STs and predict the interference in the future. Simulation results show that the transmission rate of the proposed algorithm can converge to 90% ^ 100% transmission rate of the optimal MCS selection algorithm, which assumes that the interference from the STs is perfectly known at the PR as prior information. Meanwhile, the transmission rate of the proposed algorithm is around 100% higher than the transmission rate of the benchmark algorithm, which selects the MCS without the information about interference.","Deep Reinforcement Learning ,  Optimization Algorithm ,  Transmission Rate ,  Spectral Bands ,  Selection Algorithm ,  Optimal Selection ,  Cognitive Networks ,  Wireless Link ,  User Pairing ,  Secondary Users ,  Deep Reinforcement Learning Agent ,  Environmental Conditions ,  State Space ,  Wireless Networks ,  Optimal Policy ,  Intelligence Algorithms ,  Reward Function ,  Channel Gain ,  Local Memory ,  Successive Phases ,  Rayleigh Fading ,  Long-term Reward ,  Deep Reinforcement Learning Algorithm ,  Optimal Action ,  Decision-making Scenarios ,  Symbol Error Rate ,  Transmission Frame ,  Uplink Data ,  Experience Replay ,  Previous Frame "
Contention Window-Based MAC Protocol for Wireless Sensor Networks,https://ieeexplore.ieee.org/document/6945737/,1,Conference Paper,IEEE,2014,"Existing duty-cycle MAC protocols for wireless sensor networks(WSNs), such as S-MAC, mostly do not consider the influence of inherent traffic distribution characteristic derived from network infrastructure, leading to significant end-to-end delivery latency and poor medium contention handling in data gathering. To mitigate these drawbacks, we propose a novel duty-cycle MAC protocol, called RL-MAC (location-based RMAC). Firstly RL-MAC exploits a location-based configuration strategy to configure nodes with un-uniform CWmin (minimum contention window) values during network initialization, in order to optimize application-level medium access fairness, avoiding packet loss and buffer overflow incurred by mismatches between un-uniform payload distribution over nodes in different position and node-level equal medium access scheme adopted by current protocols. Secondly like RMAC, RL-MAC can forward data packets over multiple hops per cycle through intermediate nodes according to cross-layer routing information, significantly reducing end-to-end delivery latency. Our simulation results obtained on ns-2 show that RL-MAC can better accommodate data gathering applications, providing high throughput and packet delivery ratio without sacrificing energy efficiency.","Wireless Sensor Networks ,  MAC Protocol ,  Energy Efficiency ,  Per Cycle ,  Network Infrastructure ,  Data Packets ,  Packet Loss ,  Medium Access ,  Packet Delivery ,  Minimum Window ,  Packet Delivery Ratio ,  Buffer Overflow ,  Configuration Scheme ,  Energy Consumption ,  Computational Details ,  Random Selection ,  Adjustment For Factors ,  Duty Cycle ,  Time Slot ,  Cycling Performance ,  Control Packets ,  Traffic Load ,  Sleep Schedule ,  Time Synchronization ,  Packet Size ,  Packet Forwarding "
QELAR: A Machine-Learning-Based Adaptive Routing Protocol for Energy-Efficient and Lifetime-Extended Underwater Sensor Networks,https://ieeexplore.ieee.org/document/5408367/,0,Journal Article,IEEE,2010,"Underwater sensor network (UWSN) has emerged in recent years as a promising networking technique for various aquatic applications. Due to specific characteristics of UWSNs, such as high latency, low bandwidth, and high energy consumption, it is challenging to build networking protocols for UWSNs. In this paper, we focus on addressing the routing issue in UWSNs. We propose an adaptive, energy-efficient, and lifetime-aware routing protocol based on reinforcement learning, QELAR. Our protocol assumes generic MAC protocols and aims at prolonging the lifetime of networks by making residual energy of sensor nodes more evenly distributed. The residual energy of each node as well as the energy distribution among a group of nodes is factored in throughout the routing process to calculate the reward function, which aids in selecting the adequate forwarders for packets. We have performed extensive simulations of the proposed protocol on the Aqua-sim platform and compared with one existing routing protocol (VBF) in terms of packet delivery rate, energy efficiency, latency, and lifetime. The results show that QELAR yields 20 percent longer lifetime on average than VBF.","ordsRouting protocols ,  distributed networks ,  wireless communication ,  mobile communication systems. "
An SDN-Enabled Framework for a Load-Balanced and QoS-Aware Internet of Underwater Things,https://ieeexplore.ieee.org/document/9997108/,12,Journal Article,IEEE,2023,"The massive demand for marine exploitation has promoted the thriving Internet of Underwater Things (IoUT). The volume, velocity, and variety (3V) of data produced by sensors, hydrophones, and cameras in IoUT are enormous, which challenges the network in achieving load balancing and Quality-of-Service (QoS) provisioning. This article adopts the “SDN+AI” paradigm to realize a load-balanced and QoS-aware software-defined IoUT from a framework design. We first introduce SDN technology to separate the data plane from the control plane to enhance the network’s scalability and flexibility. Then, a multicontroller load-balancing strategy based on switch migration called CASM is proposed to improve the network’s performance further. With the global view provided by SDN controllers, we proposed a QoS-aware adaptive routing protocol (SQAR) based on reinforcement learning, which can intelligently select route paths to satisfy the QoS requirements of multiple IoUT services. The results show that CASM achieves an efficient load balance while shortening the response time and average control path latency of the switch migration process, which significantly benefits our routing protocol. SQAR outperforms the existing QoS-aware routing protocols regarding QoS satisfaction probability, energy consumption, and convergence rate. Overall, our framework maintains a QoS violation rate below 5% and a load-balancing rate above 90% in a timely manner.","Load Balancing ,  Response Time ,  Convergence Rate ,  Version Of Protocol ,  Average Latency ,  Quality Of Service Requirements ,  Control Plane ,  Routing Path ,  Learning Rate ,  Softmax ,  Shortest Path ,  Flow Data ,  Adjustable Parameters ,  Time Efficiency ,  Reward Function ,  Markov Decision Process ,  Transmission Distance ,  Flow Set ,  Distributed Architecture ,  Autonomous Underwater Vehicles ,  Master Controller ,  Routing Decisions ,  Global Topology ,  Packet Delivery Ratio ,  Load Imbalance ,  Flow Table ,  Link Bandwidth ,  Energy Of Nodes ,  Temperature Coefficient "
DRL-UTPS: DRL-Based Trajectory Planning for Unmanned Aerial Vehicles for Data Collection in Dynamic IoT Network,https://ieeexplore.ieee.org/document/9916069/,27,Journal Article,IEEE,2023,"Using highly maneuverable Unmanned Aerial Vehicles (UAV) to collect data is a fast and efficient method that is widely studied. In most studies, they assume that the UAVs can obtain the location of the Cluster Head (CH) before take-off, allocate CHs, and optimize the trajectory in advance. However, in many real scenarios, many sensing devices are deployed in areas with no basic communication infrastructure or cannot communicate with the Internet due to emergencies such as disasters. In this kind of sensing network, the surviving devices often change, and the CHs cannot be known and allocated in advance, thus bringing new challenges to the efficient data collection of the networks by using UAVs. In this paper, a UAV path planning scheme for IoT networks based on reinforcement learning is proposed. It plans hover points for UAV by learning the historical location of CHs and maximizes the probability of meeting CHs and plans the shortest UAV path to visit all hover points by using the simulated annealing method. In addition, an algorithm to search for the location of CHs is proposed which is named Cluster-head Searching Algorithm with Autonomous Exploration Pattern (CHSA-AEP). By using CHSA-AEP, our scheme enables the UAV to respond to the position change of the CHs. Finally, we compare our scheme with other algorithms (area coverage algorithms and random algorithm). It is found that our proposed scheme is superior to other methods in energy efficiency and time utilization ratio.","Unmanned Aerial Vehicles ,  Trajectory Planning ,  IoT Networks ,  Disaster ,  Energy Efficiency ,  Shortest Path ,  Simulated Annealing ,  Path Planning ,  Cluster Head ,  Energy Consumption ,  Time Slot ,  Reduce Energy Consumption ,  Network Clustering ,  Internet Of Things Devices ,  Reward Function ,  Total Energy Consumption ,  Deep Reinforcement Learning ,  Markov Decision Process ,  Wireless Sensor Networks ,  Non-line-of-sight ,  Unmanned Aerial Vehicle Trajectory ,  Proximal Policy Optimization ,  Traveling Salesman Problem ,  Network Devices ,  Flight Trajectory ,  Unmanned Aerial Vehicle Flight ,  Simulated Annealing Algorithm ,  Flight Path ,  Unmanned Aerial Vehicle Flies ,  Dynamic Routing "
Finding MARLIN: Exploiting multi-modal communications for reliable and low-latency underwater networking,https://ieeexplore.ieee.org/document/8057132/,35,Conference Paper,IEEE,2017,"This paper concerns the smart exploitation of multimodal communication capabilities of underwater nodes to enable reliable and swift underwater networking. To contrast adverse and highly varying channel conditions we define a smart framework enabling nodes to acquire knowledge on the quality of the communication to neighboring nodes over time. Following a model-based reinforcement learning approach, our framework allows senders to select the best forwarding relay for its data jointly with the best communication device to reach that relay. We name the resulting forwarding method MARLIN, for MultimodAl Reinforcement Learning-based RoutINg. Applications can choose whether to seek reliable routes to the destination, or whether faster packet delivery is more desirable. We evaluate the performance of MARLIN in varying networking scenarios where nodes communicate through two acoustic modems with widely different characteristics. MARLIN is compared to state-of-the-art forwarding protocols, including a channel-aware solution, a machine learning-based solution and to a flooding protocol extended to use multiple modems. Our results show that a smartly learned selection of relay and modem is key to obtain a packet delivery ratio that is twice as much that of other protocols, while maintaining low latencies and energy consumption.","Multimodal Communication ,  Energy Consumption ,  Neighboring Nodes ,  Low Latency ,  Communication Devices ,  Fast Delivery ,  Packet Delivery ,  Model-based Reinforcement Learning ,  Packet Delivery Ratio ,  Data Rate ,  Value Function ,  Cost Function ,  State Space ,  Transition Probabilities ,  Network Size ,  Optimal Policy ,  Multiple Devices ,  Final Destination ,  Wireless Sensor Networks ,  Autonomous Underwater Vehicles ,  Data Packets ,  Packet Collisions ,  Packet Header ,  Bitrate ,  Packet Loss ,  Packet Transmission ,  Control Packets ,  Residual Energy ,  Most Significant Bit "
Machine-Learning-Based Optimal Cooperating Node Selection for Internet of Underwater Things,https://ieeexplore.ieee.org/document/10479225/,1,Journal Article,IEEE,2024,"Multihop communication has gained prominence within the realm of the Internet of Underwater Things (IoUT) owing to its exceptional reliability amidst the challenges posed by the underwater acoustic environment. Despite this, the persistence of limitations caused by propagation delay, high collision rate, and limited energy in underwater communication remains, representing the most formidable hurdles in ensuring the successful transmission of data gathered by sensor nodes. To address these challenges, we employ a machine learning (ML)-based optimal cooperating node selection for each hop, considering the Shortest propagation delay, minimal residual Energy, and a low Collision rate (referred to as SEC). For this purpose, we initially assemble the sensor nodes to create a list of cooperative nodes, considering the aspect of SEC. Then, using an assembled list of cooperating sensor nodes, we employ ML-based algorithms, such as reinforcement learning (RL-SEC), deep Q-networks (DQN-SEC), and deep deterministic policy gradient (DDPG-SEC), to predict the optimal cooperating node for each hop. The simulation results of the DDPG-SEC demonstrate a significant improvement of approximately 56% when compared with RL-SEC, DQN-SEC, and other state-of-the-art techniques.","Optimal Selection ,  Optimal Node ,  Policy Learning ,  Successful Transmission ,  Propagation Delay ,  Residual Energy ,  Policy Gradient ,  Deep Q-network ,  List Of Nodes ,  Underwater Communication ,  Reinforcement Learning Policy ,  Multi-hop Communication ,  Energy Consumption ,  Average Energy ,  Neighboring Nodes ,  Bit Error Rate ,  Real-world Environments ,  Markov Decision Process ,  Target Network ,  Data Packets ,  Destination Node ,  Undersea ,  Policy Gradient Method ,  Successful Transmission Probability ,  Network Throughput ,  Source Node ,  Primary Network ,  Control Packets ,  Arrival Rate ,  Replay Buffer "
Traffic-Aware Configuration of All-Optical Data Center Networks Based on Hyper-FleX-LION,https://ieeexplore.ieee.org/document/10433414/,0,Journal Article,IEEE,2024,"Due to the advantages of optical circuit switching (OCS), all-optical data center networks (DCNs) have attracted intensive research interests recently. Hyper-FleX-LION is a highly-flexible all-optical DCN architecture that operates with the OCS based on wavelength-division multiplexing (WDM). In this work, we study how to realize traffic-aware configuration of all-optical DCNs in Hyper-FleX-LION. We formulate an integer linear programming (ILP) model for the problem to jointly optimize the configuration of Hyper-FleX-LION and the provisioning schemes of demands in it for minimizing its port usage. To ensure the practicalness of the optimization, we assume that each top-of-rack (ToR) switch can not only receive the traffic targeting to its rack but also forward traffic to other racks as an intermediate node. We also classifier traffic demands as normal and latency-sensitive ones, and set the maximum hop-count for routing latency-sensitive demands. By analyzing the complexity of the problem theoretically, we prove its 
 $\mathcal {APX}$ 
-hardness, i.e., there does not exist a polynomial-time approximation algorithm for it unless 
 $\mathcal {P}=\mathcal {NP}$ 
. Then, we propose a polynomial-time heuristic JTRO based on iterative optimization to solve the problem effectively and time-efficiently. Extensive numerical simulations verify the effectiveness of our proposed algorithm. We also build a small-scale but real all-optical DCN testbed in Hyper-FleX-LION to interconnect four racks, and leverage distributed machine learning (DML) as the network services in it to demonstrate the performance of our proposal experimentally.","Data Center Networks ,  Heuristic ,  Hardness ,  Model Problem ,  Network Services ,  Iterative Optimization ,  Polynomial-time Algorithm ,  Linear Programming Model ,  Optical Switching ,  Traffic Demand ,  Wavelength Division Multiplexing ,  Integer Linear Programming Model ,  Distributed Machine Learning ,  Convolutional Neural Network ,  Feasible Solution ,  Directed Graph ,  Specific Instances ,  Deep Reinforcement Learning ,  Traffic Load ,  Topology Optimization ,  Traffic Routes ,  Job Completion Time ,  Master Node ,  Topology Design ,  Types Of Demands ,  Receptor For Activated C Kinase 1 ,  Bandwidth Usage ,  Worker Nodes ,  Routing Path ,  Routing Scheme "
Packet Delivery Maximization Using Deep Reinforcement Learning-Based Transmission Scheduling for Industrial Cognitive Radio Systems,https://ieeexplore.ieee.org/document/9585683/,0,Journal Article,IEEE,2021,"The performance of data aggregation in industrial wireless communications can be degraded by environmental interference on Industrial Scientific Medical (ISM) channels. In this paper, cognitive radio (CR) was applied to enable devices to share primary channels with the aim of enhancing the transmission performance of the WirelessHART network. We considered a linear convergecast system, where the packets generated at each device were routed to the gateway (GW) through the aid of neighboring devices. The solar-powered cognitive access points (CAPs) were deployed to improve the network performance by opportunistically allocating the primary channels to the devices for data transmissions. Firstly, we formulate the scheduling problem of long-term throughput maximization as a framework of a Markov decision process with the constraints of the minimum delay, the number of required ISM channels, and the harvested energy at the CAPs. Then, we propose a deep reinforcement learning-based scheduling scheme to optimally assign multiple ISM and primary channels to the field devices in each superframe. The simulation results confirmed the superiority of the proposed scheme compared to existing methods.","Cognitive Radio ,  Packet Delivery ,  Transmission Scheduling ,  Data Transmission ,  Network Performance ,  Energy Harvesting ,  Markov Decision Process ,  Primary Channel ,  Deep Learning ,  Probability Values ,  Wireless Networks ,  Flow Data ,  False Alarm ,  Time Slot ,  Optimal Policy ,  Channel Flow ,  Deep Reinforcement Learning ,  Wireless Sensor Networks ,  Data Packets ,  Cognitive Networks ,  Industrial Networks ,  Deep Q-learning ,  Solar Energy Harvesting ,  Replay Memory ,  System Throughput ,  Joint Data ,  Network Throughput ,  Successful Transmission Probability ,  Linear Function ,  Dynamic Channel "
