title,link,number_of_citation,article_type,publisher,publication_date,abstract,keyword
Reinforcement Learning-Based Routing Protocol for Underwater Wireless Sensor Networks: A Comparative Survey,https://ieeexplore.ieee.org/document/9615209/,12,Journal Article,IEEE,2021,"Underwater wireless sensor networks (UWSNs) have emerged as a promising networking technology owing to their various underwater applications. Many applications require sensed data to be routed to a centralized location. However, the routing of sensor networks in underwater environments presents several challenges in terms of underwater infrastructure, including high energy consumption, narrow bandwidths, and longer propagation delays than other sensor networks. Efficient routing protocols play a vital role in this regard. Recently, reinforcement learning (RL)-based routing algorithms have been investigated by different researchers seeking to exploit the learning procedure via trial-and-error methods of RL. RL algorithms are capable of operating in underwater environments without prior knowledge of the infrastructure. This paper discusses all routing protocols proposed for RL-based UWSNs. The advantages, disadvantages, and suitable application areas are also mentioned. The protocols are compared in terms of the key ideas, RL designs, optimization criteria, and performance-evaluation techniques. Moreover, research challenges and outstanding research issues are also highlighted, to indicate future research directions.","Wireless Sensor Networks ,  Underwater Wireless Sensor Networks ,  Energy Consumption ,  Optimization Criteria ,  Reinforcement Learning Algorithm ,  Propagation Delay ,  Undersea ,  Routing Algorithm ,  Underwater Applications ,  Neighboring Nodes ,  Reward Function ,  Data Packets ,  Source Node ,  Residual Energy ,  Acoustic Communication ,  Relay Nodes ,  Routing Path ,  Autonomous Underwater Vehicles ,  Dynamic Topology ,  Sink Node ,  Network Lifetime ,  Mobile Nodes ,  Packet Drop ,  Energy Of Nodes ,  Packet Forwarding ,  Node Depth ,  Packet Delivery Ratio ,  Underwater Communication ,  Vehicular Ad Hoc Networks "
Application of machine learning (reinforcement learning) for routing in Wireless Sensor Networks (WSNs),https://ieeexplore.ieee.org/document/6260967/,8,Conference Paper,IEEE,2012,"Traditionally, protocols and applications in the networking domain have been designed to work in large-scale heterogeneous, hierarchically organized networks with low failure rate. In a Wireless Sensor Network (WSN) scenario, new problems arise and traditional routing protocols cannot be successfully applied. Additionally, in energy-restricted environments like WSNs the overhead of keeping routing information fresh becomes unbearable. In this problem context problem context, many researchers have turned their attention to the domain of machine learning (ML). The goal of this paper is to analyze the application of the Reinforcement Learning (specifically Q-learning) for an energy- aware routing scenario.","Sensor Networks ,  Wireless Sensor Networks ,  Lower Failure Rate ,  Energy Levels ,  Lowest Energy ,  Wireless Networks ,  Shortest Path ,  Neighboring Nodes ,  Original Algorithm ,  Multiple Paths ,  Load Balancing ,  Node Level ,  Traffic Load ,  Energy Capacity ,  Routing Algorithm ,  Medium Access Control ,  Extra Overhead ,  Traffic Simulation ,  Q-learning Algorithm ,  Network Packets ,  Routing Table ,  Network Lifetime ,  Energy Of Nodes ,  Network Load ,  Simulation Environment ,  Computational Overhead ,  Feedback Delay ,  Exponential Function ,  Linear Function "
Enhancing Wireless Sensor Network Routing Strategies with Machine Learning Protocols,https://ieeexplore.ieee.org/document/10537481/,0,Conference Paper,IEEE,2024,"Woth the realm of Internet supportive Things (IoT), where numerous wireless components constantly communicate, a unique challenge arises. This challenge includes issues such as handling diverse devices, ensuring data broadcasting and managing scalability. To handle these issues, a new routing protocol has been proposed in this paper. This protocol is intelligent, energy-conscious, and employs a multi-objective approach, based on the distribution type Reinforcment based Learn -Driven (RL) mechanism integrated Meta-Learning termed as Data synchronized -Machine learning (DS-ML). The core goal of proposed data-route mechanism, called DS-ML, will optimized power consumption on IoT connected networks, a critical issue given the defined power resources of wireless connected IoT Components. Additionally, mechanism focuses on adapting to network changes seamlessly by ensuring smooth adjustments to alterations and minimizing disruptions to enhances entire network Efficacy. The algorithm incorporates correlates issues in rewards designed in acceleration of the learn cycle. Through various simulation parameters, the DS-ML routing protocol demonstrated significant improvements in power efficacy and rapid adapt in unexpected network happenings. This was evidenced by enhancements in delivered ratio of data sets and reductions in data-sets delivery latency when compares in conventional data-routing Techniques. In general, proposed DS-ML system represents a solution for enhancing the performances and sustainability of IoT network infrastructure.","Sensor Networks ,  Wireless Sensor ,  Wireless Sensor Networks ,  Machine Learning Protocol ,  Network Changes ,  All-to-all Communication ,  Energy Consumption ,  Learning Process ,  Specific Tasks ,  Performance Metrics ,  Internet Of Things ,  Data Transmission ,  Network Performance ,  Network State ,  Pathfinding ,  Energy Usage ,  Reward Function ,  Data Packets ,  Nodal Points ,  Traffic Load ,  Packet Delivery Ratio ,  Routing Algorithm ,  Sensory Environment ,  Delay Increases ,  Routing Decisions ,  Current State Of The Environment ,  Iterative Process ,  Network Topology ,  Sensor Devices "
Delay Analysis of Routing Protocols for WSN,https://ieeexplore.ieee.org/document/10323768/,0,Conference Paper,IEEE,2023,"In this paper, we explore the benefits of cooperative diversity for Wireless Sensor Network (WSN). Relays are uniformily distributed in 
$L$
 hops and 
$N$
 branches between the sensor nodes SN and the base station BS. Three cooperative routing protocols are considered, namely: one hop, suboptimal and optimal routing protocols. One hop routing chooses the best relay in each hop. Optimal routing selects the best path between SN and BS. Suboptimal routing decomposes the network into 
$K$
 subnetworks and selects successively the best path in each one. We derive the outage probability, the Packet Error Probability (PEP) and the queening delays spent in the system for each protocol.","Wireless Sensor Networks ,  Base Station ,  Bit Error Rate ,  Pathfinding ,  Outage Probability ,  Hierarchical Structure ,  Probability Density Function ,  Time Slot ,  K-means Algorithm ,  Deep Reinforcement Learning ,  Cooperative Strategy ,  Rayleigh Fading ,  Total Delay ,  Cumulative Density Function ,  Relay Nodes ,  Cluster Head ,  Network Lifetime ,  Quadrature Phase Shift Keying ,  Slot Duration ,  Packet Arrival ,  Consecutive Nodes ,  Multiple-access Channel "
Back Propagation Neural Network-Based Routing Optimization for IoT,https://ieeexplore.ieee.org/document/10346315/,0,Conference Paper,IEEE,2023,"The Internet of Things (IoT) has fundamentally changed how we engage with the environment that surrounds us by facilitating the connection of various devices and the flow of data between them. However, as the complexity of IoT networks increases, effective routing becomes more and more important to guarantee that data transfer and network performance are at their best. It is possible that traditional routing algorithms would not be able to manage the size and fluidity of Internet of Things networks. Optimizing the routing of Internet of Things devices has necessitated the use of more cutting-edge methods, such as the Back Propagation Neural Network (BPNN), which has been developed by researchers. In this research paper, we provide a unique strategy to handle the routing optimization issue in IoT by employing BPNNs. Back Propagation Neural Networks is a kind of neural network. By using the tremendous capabilities of artificial neural networks, the BPNN-based routing optimization intends to improve the efficacy of IoT networks as well as their adaptability.","Internet Of Things ,  Pathfinding ,  Neural Network ,  Artificial Neural Network ,  Network Performance ,  Internet Of Things Devices ,  Back Propagation Neural Network ,  Internet Of Things Networks ,  Routing Algorithm ,  Kind Of Neural Network ,  Service Quality ,  Energy Efficiency ,  Network Topology ,  Energy Use ,  Fault-tolerant ,  Limitation Of This Work ,  Sensor Networks ,  Amount Of Power ,  Wireless Sensor Networks ,  Ad Hoc Networks ,  Packet Delivery Ratio ,  Routing Decisions ,  Route Choice ,  Mobile Nodes ,  Routing Method ,  Traffic Load ,  Data Packets ,  Node Information "
Clustering-Based Reinforcement Learning Routing Protocol with Low Complexity for Underwater Acoustic Sensor Networks,https://ieeexplore.ieee.org/document/9538885/,1,Conference Paper,IEEE,2021,"With the increase in the number of relay nodes in large-scale underwater acoustic sensor networks (UWA-SNs), the learning costs of routing protocols based on reinforcement learning algorithms continue to increase. In this paper, we take the Q-learning (QL) algorithm as the example of the reinforcement learning algorithm, combined with the clustering algorithm based on genetic simulated annealing algorithm (SAGAFCM), and propose an improved QL routing protocol (IQLR) aimed at reducing the time complexity of QL-based routing algorithm. The core idea is to preprocess the underwater relay nodes before applying the traditional QL algorithm for routing optimization. The simulation results show that compared with the un-preprocessed/traditional QL routing algorithm (UQLR), the proposed IQLR can greatly reduce the time cost of the QL-based routing algorithm while ensuring that the transmission quality does not change much.","Acoustic Networks ,  Increase In The Number ,  Learning Algorithms ,  Clustering Algorithm ,  Simulated Algorithm ,  Reinforcement Learning Algorithm ,  Polynomial-time Algorithm ,  Simulated Annealing Algorithm ,  Routing Algorithm ,  Relay Nodes ,  Q-learning Algorithm ,  Quality Of Transmission ,  Energy Consumption ,  Total Distance ,  Energy Transmission ,  Reward Function ,  Cluster Nodes ,  Selection Stage ,  Source Node ,  Residual Energy ,  Transmission Energy Consumption ,  Route Selection ,  Route Design ,  Energy Of Nodes "
A Lifetime-Aware Centralized Routing Protocol for Wireless Sensor Networks using Reinforcement Learning,https://ieeexplore.ieee.org/document/9606390/,3,Conference Paper,IEEE,2021,"This paper presents the design of a Lifetime-Aware Centralized Q-routing Protocol (LACQRP) for Wireless Sensor Network (WSN) to maximize the network lifetime. This is achieved by implementing Q-learning on the sink of the WSN, which also acts as a controller that has global knowledge of the network topology as enabled by Software-Defined WSN (SDWSN). The controller generates all possible distance-based minimum spanning trees (MSTs), which form the set of routing tables (RTs). The maximization of the network lifetime is achieved by the controller learning the routing table that minimizes the maximum of the sensor nodes’ consumption energies using Reinforcement Learning (RL). The simulation results show that the LACQRP learns the best RT that maximizes the network lifetime and has a better network lifetime performance when compared with recent distributed RL routing protocols for lifetime optimization, which are Reinforcement Learning-Based Routing (RLBR) and Reinforcement Learning for Lifetime Optimization (R2LTO).","Sensor Networks ,  Wireless Sensor Networks ,  Centralized Routing ,  Spanning Tree ,  Network Lifetime ,  Routing Table ,  Energy Consumption ,  Energy Source ,  Distance Function ,  Energy Transmission ,  Reward Function ,  Optimal Path ,  Data Packets ,  Residual Energy ,  Learning Agent ,  Transmission Range ,  Routing Path ,  Energy Of Nodes ,  Network Energy Efficiency ,  Hop Count "
QEnergy and SARSAEnergy Learning for Energy efficient Routing in Wireless Sensor Networks,https://ieeexplore.ieee.org/document/9807754/,1,Conference Paper,IEEE,2022,"Wireless sensor network nodes will be located at varying distances in the network, and the data travel between each node requires the shortest path to transmit data. In data transmission, when a particular node is active for a long time, it will lead to energy depletion and the node will remain active based on residual energy. Reinforcement learning with the Markov model assigns rewards for the best path taken to transmit data between nodes. The nodes are located randomly with the Erdos-Renyi random graph model, which is a stochastic graph. The energy consumption depends on the amount of data transmitted and how long the particular node is active. The proposed QEnergy-Learning and SARSAEnergy algorithms can be used to calculate energy consumption in the wireless sensor network with rewards. The proposed work efficiency is evaluated by taking into account various WSN infrastructure and calculating energy consumption. The agent learns its environment and transmits data packets, and its performance is compared to that of various algorithms in different network infrastructures.","Sensor Networks ,  Wireless Sensor Networks ,  Energy-efficient Routing ,  Energy Consumption ,  Data Transmission ,  Shortest Path ,  Graphical Model ,  Network Infrastructure ,  Random Graph ,  Residual Energy ,  Network Distance ,  Erdős-Rényi Model ,  Data Packet Transmission ,  Learning Algorithms ,  Support Vector Machine ,  Artificial Neural Network ,  Hidden Markov Model ,  Transition Probabilities ,  Linear Programming ,  Inactive State ,  Markov Decision Process ,  Energy Of Nodes ,  Network Lifetime ,  Routing Information ,  Wireless Power Transfer ,  Scheduling Algorithm ,  Linear Problem ,  Mixed Integer Linear Programming ,  Cluster Head ,  Pathfinding "
MeFi: Mean Field Reinforcement Learning for Cooperative Routing in Wireless Sensor Network,https://ieeexplore.ieee.org/document/10164652/,2,Journal Article,IEEE,2024,"Wireless sensor networks (WSNs) enable intelligent collaborative perceptions in the Internet of Things. However, devices in WSNs are battery-powered with limited energy resources. During transmission, routing policies significantly affect the energy efficiency in terms of both energy consumption and energy balance among nodes, and further impact the network lifetime. Previous works mostly used heuristic fixed strategies to make routing decisions based on incomplete information in a distributed manner for lower control costs and faster calculation when facing numerous devices in WSNs, which easily lead to performance limitations and routing loops. To this end, we model the network lifetime maximization problem as a decentralized partially observable Markov decision process and propose a new scheme MeFi based on Mean Field Reinforcement Learning to perform real-time energy-efficient routing policies for WSNs. The utilization of Mean Field Theory effectively simplifies the intractable interactions among numerous agents and guides the policy training. Additionally, a prioritized-sampling loop-free algorithm is developed to eliminate routing loops and avoid routing policies with significant energy consumption. Experimental results show that our scheme outperforms several algorithms by up to 50%, significantly enhancing energy efficiency and extending WSN lifetime under different circumstances.","Mean-field ,  Wireless Sensor Networks ,  Wireless Sensor Network Routing ,  Energy Consumption ,  Energy Efficiency ,  Internet Of Things ,  Markov Decision Process ,  Network Lifetime ,  Routing Decisions ,  Inner Layer ,  Energy Distribution ,  Network State ,  Root Node ,  Actor Network ,  Reward Function ,  Nash Equilibrium ,  Residual Energy ,  Observation Space ,  Set Of Agents ,  Critic Network ,  Monte Carlo Tree Search ,  Sink Node ,  Energy Of Nodes ,  Spanning Tree ,  Well-trained Model ,  Transmission Range ,  Multi-agent Reinforcement Learning ,  Function Of Agent ,  Online Algorithm ,  Policy Agencies "
Soft computing techniques to address various issues in wireless sensor networks: A survey,https://ieeexplore.ieee.org/document/7813753/,3,Conference Paper,IEEE,2016,"Wireless sensor network (WSN) is a collection of large number of self-organized types of sensors which chain together to monitor and record physical or environmental conditions (i.e. used to measure temperature, sound, pressure) and passes gathered information to the central location. WSN build bridge between real world and virtual environment, which makes it more utilizable for many applications. Mainly WSN was used for military arena but now a days it is used in various area like industrial applications, consumer applications, health care applications and many more. Despite of having many advantages there are some issues also occurred in WSNs like hotspot problem, energy hole problem, routing, coverage problem, load balancing problem and so on. These issues effect on different factors of WSN named energy consumption, stability, quality, deployment time, lifetime of network, which degrade the performance of the WSN. To solve these issues various researchers develop different mechanisms. Among all of them, in this paper, we survey different kind of soft computing paradigms. Soft computing is a technique to use of improper solutions to solve the complicated problem in robust time. There are various types of soft computing techniques developed: swarm intelligence, fuzzy logic, neural network, reinforcement learning and evolutionary algorithm, which used to solve WSN problems so that performance of the network will be increased.","Sensor Networks ,  Wireless Sensor Networks ,  Soft Computing ,  Soft Computing Techniques ,  Neural Network ,  Energy Consumption ,  Learning Algorithms ,  Evolutionary Algorithms ,  Fuzzy Logic ,  Reinforcement Learning Algorithm ,  Swarm Intelligence ,  Coverage Problem ,  Network Lifetime ,  Optimization Algorithm ,  Probabilistic Model ,  Clustering Algorithm ,  Base Station ,  Particle Swarm Optimization ,  Neighboring Nodes ,  Data Fusion ,  Ant Colony Optimization Algorithm ,  Cluster Head ,  Ant Colony Optimization ,  Fuzzy Control ,  Fuzzy Clustering ,  Residual Energy ,  Sensor Deployment ,  Routing Table ,  Routing Algorithm ,  Time Difference Of Arrival "
A Survey on Utilizing Reinforcement Learning in Wireless Sensor Networks Routing Protocols,https://ieeexplore.ieee.org/document/10039013/,2,Conference Paper,IEEE,2022,"This article reviews the control and routing methods in Wireless Sensor Networks. These methods are able to increase the energy efficiency by using the reinforcement learning technique, considered as one of the means of machine learning. It is based on the reward and punishment technique which has a behavior similar to the learning process in children. Appropriate energy management and therefore lifespan increase in wireless sensor networks is one of the main issues in these types of networks due to the energy consumption limitation in its nodes. The purpose of writing the current article is to get acquainted with the relative methods provided. In this article, various means which are trying to use the reinforcement learning process to improve the behavior of wireless sensor networks and to make them smarter are presented and analyzed. Meanwhile, the evolution of these methods and the ratio of the superiority of each in comparison to the others have been examined.","Sensor Networks ,  Wireless Sensor ,  Wireless Sensor Networks ,  Energy Consumption ,  Learning Process ,  Wireless Networks ,  Reinforcement Learning Techniques ,  Routing Method ,  Value Function ,  Number Of Steps ,  Shortest Path ,  State Value ,  Information In Order ,  Optimal Policy ,  Neighboring Nodes ,  Techniques In Order ,  Source Node ,  Target Node ,  Policy Gradient ,  Current Node ,  Energy Of Nodes ,  Sink Node ,  Aggregation Techniques ,  Policy Gradient Method ,  Relay Nodes ,  Information Packets ,  Optimality Equation ,  Path Nodes ,  Data Transmission ,  Network Flow "
Distributed QoS routing algorithm in large scale Wireless Sensor Networks,https://ieeexplore.ieee.org/document/6237195/,3,Conference Paper,IEEE,2012,"This paper presents a novel routing protocol based on the Learning Automata method for large scale Wireless Sensor Networks (WSNs) codenamed DRLR (distributed reinforcement learning routing). In this method, each node is equipped with learning automata so that it can learn the best path to transmit data toward the sink. The approach proved to be efficient, reliable, and scalable. It also prevents routing hole by considering network density and average of energy levels available. The approach also increases network lifetime by balancing energy consumption. We compared our approach to two other methods (MMSPEED and EESPEED) and the simulation results show our algorithm to better meet end-to-end delay and reliability requirements and to improve network lifetime more.","Sensor Networks ,  Wireless Sensor Networks ,  Routing Algorithm ,  Scalable ,  Dense Network ,  Network Lifetime ,  Self-organization ,  Global Positioning System ,  Data Packets ,  Energy Parameters ,  Selection Phase ,  Residual Energy ,  Network Load ,  Routing Decisions ,  Routing Table ,  Packet Forwarding ,  Routing Approach "
Latency filtering for Q-routing on wireless networks,https://ieeexplore.ieee.org/document/9498737/,0,Conference Paper,IEEE,2021,"Q-routing is inspired by Q-learning, a reinforcement learning algorithm. Originally, it uses latency as routing metric. But, latency can be difficult to estimate especially in a noisy wireless environment. In this paper, we propose to filter the latency measure with a moving average, in order to improve the quality of service metrics such as packet delivery ratio and average delay. We compare our modification to the original Q-routing and use OLSRv2 as reference routing protocol. We observe an improvement of the average delivery time on a wireless grid of 3 % compared to the original Q-routing. On our mobility scenario, the number of routes changes is at least twice lower (from 6 to 3 route changes between the two approaches in this scenario). The gain on QoS metrics depends mainly on the speed of the nodes. These improvements are obtained without making Q-routing more complex as a moving average is added. We provide all the materials to conduct reproducible research on our public git repository.","Wireless Networks ,  Service Quality ,  Latency Measures ,  Mobility Scenarios ,  Packet Delivery Ratio ,  Learning Rate ,  Shortest Path ,  Simulated Networks ,  Wireless Sensor Networks ,  Application Layer ,  Toy Example ,  Ad Hoc Networks ,  Greedy Strategy ,  High Load Condition ,  Change In The Average Number "
