title,link,number_of_citation,article_type,publisher,publication_date,abstract,keyword
"A Survey on Traffic Management in Software-Defined Networks: Challenges, Effective Approaches, and Potential Measures",https://dl.acm.org/doi/10.1007/s11277-021-08100-3,1,review-article,ACM,2021,"Software-defined networks (SDNs), as an emerging paradigm by separating the control plane from the data plane, increases flexibility and network utilization and reduces redundancy and operational cost. Traffic management of software-defined networks can be defined as network traffic monitoring and analyzing measures to improve network performance and quality of service metrics. Traffic management as an effective instrument for optimizing network traffic can offer the appropriate services according to network situation. Due to the inherent characteristics of SDN, special techniques are required to analyze, predict, and adapt the network traffic in order to achieve an efficient traffic management mechanism. This paper surveys traffic management techniques of SDN in four distinct categories including, routing, load balancing, congestion control, and flow control to cover the impressible issues. Moreover, the differences between SDN and traditional networks are analyzed in terms of traffic management necessities across the various groups to further determine the dimensions affecting research in this area. Furthermore, the available algorithms in each group and their role in traffic management are reviewed as well as the research challenges and future trends.",none
Ant Colony Optimization Based Orthogonal Directional Proactive---Reactive Routing Protocol for Wireless Sensor Networks,https://dl.acm.org/doi/10.1007/s11277-015-2733-3,3,article,ACM,2015,"Routing protocols for wireless sensor networks are important in addressing the various quality-of-service (QoS) issues pertaining to different applications. The most important QoS issues while designing routing protocols for WSN are energy awareness, scalability and network lifetime. However to deal with these issues the solutions provided in related literature have certain inherent disadvantages like high control overhead, low packet delivery ratio and requirement of global location information. In order to resolve these issues, we propose an orthogonal transmission based scalable, lightweight and energy aware routing protocol named as OD-PPRP which does not require global location information and has low control overhead. The proposed protocol OD-PRRP has the characteristics of both reactive and proactive routing protocols and utilizes fuzzy logic and Ant Colony Optimization to identify energy efficient and optimal paths. The simulation results show in both static and dynamic environment, OD-PRRP has better network lifetime, low end to end transmission delay, less overhead and high packet delivery ratio than other state of art QoS aware routing protocol viz. EARQ, EAODV and EEABR.",none
DLSA: Delay and Link Stability Aware Routing Protocol for Flying Ad-hoc Networks (FANETs),https://dl.acm.org/doi/10.1007/s11277-021-08839-9,1,research-article,ACM,2021,"Flying Ad-hoc Network (FANET) is a new class of Mobile Ad-hoc Network in which the nodes move in three-dimensional (3-D) ways in the air simultaneously. These nodes are known as Unmanned Aerial Vehicles (UAVs) that are operated live remotely or by the pre-defined mechanism which involves no human personnel. Due to the high mobility of nodes and dynamic topology, link stability is a research challenge in FANET. From this viewpoint, recent research has focused on link stability with the highest threshold value by maximizing Packet Delivery Ratio and minimizing End-to-End Delay. In this paper, a hybrid scheme named Delay and Link Stability Aware (DLSA) routing scheme has been proposed with the contrast of Distributed Priority Tree-based Routing and Link Stability Estimation-based Routing FANET’s existing routing schemes. Unlike existing schemes, the proposed scheme possesses the features of collaborative data forwarding and link stability. The simulation results have shown the improved performance of the proposed DLSA routing protocol in contrast to the selected existing ones DPTR and LEPR in terms of E2ED, PDR, Network Lifetime, and Transmission Loss. The Average E2ED in milliseconds of DLSA was measured 0.457 while DPTR was 1.492 and LEPR was 1.006. Similarly, the Average PDR in %age of DLSA measured 3.106 while DPTR was 2.303 and LEPR was 0.682. The average Network Lifetime of DLSA measured 62.141 while DPTR was 23.026 and LEPR was 27.298. At finally, the Average Transmission Loss in dBm of DLSA measured 0.975 while DPTR was 1.053 and LEPR was 1.227.",none
"Scheduling and resources allocation in network traffic using multiobjective, multiuser joint traffic engineering",https://dl.acm.org/doi/10.1007/s11276-020-02407-y,0,research-article,ACM,2020,"Reciprocal optimality is a desirable characteristic from the end user perspective, for both Best Effort and Quality of Service (QoS) datagrams delivery within a network. A cohesive solution to such issues is the expected outcome of this work. It is also aimed to formulate and evaluate enhanced scheduling algorithm for packets delivery, focusing on maximal user satisfaction and minimal networking operation costs. Mathematical optimization techniques have been applied to Application, Transport and Network layers of Open System Interconnection model. Novel elucidation of optimal packets switching, traffic engineering, congestion avoidance and QoS improvements are discussed. A simplified routing mechanism is devised, along with the formulation and analysis of nonlinear constrained Multiobjective, multiuser joint traffic engineering case. This approach would be useful for networking and digital communication domains.",none
Anomaly detection in Wireless Sensor Networks using immune-based bioinspired mechanism,https://dl.acm.org/doi/10.1155/2015/684952,2,article,ACM,2015,"During the past few years, we have seen a tremendous increase in various kinds of anomalies in Wireless Sensor Network (WSN) communication. Recently, researchers have shown a lot of interest in applying biologically inspired systems for solving network intrusion detection problems. Several solutions have been proposed using Artificial Immune System (AIS), Ant Colony Optimization (ACO), Artificial Bee Colony (ABC) algorithm, Genetic Algorithm (GA), Particle Swarm Optimization (PSO) and so forth. In this paper, we propose a bioinspired solution using Negative Selection Algorithm (NSA) of the AIS for anomalies detection in WSNs. For this purpose, we implement the enhanced NSA and make a detector set that holds anomalous packets only. Then the random packets are tested and matched with the detector set and anomalies are identified. Anomalous data packets are used for further processing to identify specific anomalies. In this way, the number of wormholes, packets delayed, and packets dropped are calculated and identified. Simulations are performed on a large dataset and the results show high accuracy of the proposed algorithm in detecting anomalies. The proposed NSA is also compared with Clonal Selection Algorithm (CSA) for the same dataset. The results show significant improvement of the proposed NSA over CSA in most of the cases.",none
Hierarchical search-based routing protocol for infrastructure-based opportunistic networks,https://dl.acm.org/doi/10.1504/ijica.2021.113752,1,research-article,ACM,2021,"Opportunistic networks (OppNets) consist of intermittently connected devices where there is no guarantee that a predefined path from source to destination for message transmission exists. In such a sparsely connected network where nodes relay messages in an opportunistic manner, designing a routing protocol is a challenging task. In this paper, a novel routing protocol for infrastructure-based OppNets called the hierarchical search-based routing protocol (HSBRP) has been proposed. This protocol combines the benefits of both fixed and mobile routing techniques, combating the disadvantages posed by each, to give better performance on a multitude of performance metrics like, no single point of failure, fault detection and communication capacity, etc. In the proposed protocol, nodes are arranged in a hierarchical fashion and interactions between different levels of nodes are only allowed through well-defined rules that boost message delivery probability and reduce the overhead of the network.",none
An Empirical Study of Soft Computing Approaches in Wireless Sensor Networks,https://dl.acm.org/doi/10.4018/JCIT.296722,1,article,ACM,2022,"The optimal CH selection for finding the shortest path among the CHs is improved by developing the hybrid K-means with Particle Swarm Optimization (PSO) based hybrid Ad-hoc On-demand Distance Vector (AODV) channelling algorithms. The alive nodes, total packet sending time, throughput, and NL are increased using this hybrid technique, whereas dead nodes and EC are minimized in the network. The proposed algorithm utilizes a rotational method of utilization of cluster head (CH) to ensure that all member nodes are utilized uniformly based on the incoming traffic. The proposed algorithm has been implemented, experimented with, and compared in performance with LEACH, DLBA and GLBA algorithms. The proposed hybrid approach outperforms the existing techniques regarding average energy consumption and load distribution.",none
