title,link,number_of_citation,article_type,publisher,publication_date,abstract,keyword
Learning-Based spectrum selection in cognitive radio ad hoc networks,https://dl.acm.org/doi/10.1007/978-3-642-13315-2_11,1,Article,ACM,2010,"Cognitive Radio Ad Hoc Networks (CRAHNs) must identify the best operational characteristics based on the local spectrum availability, reachability with other nodes, choice of spectrum, while maintaining an acceptable end-to-end performance. The distributed nature of the operation forces each node to act autonomously, and yet has a goal of optimizing the overall network performance. These unique characteristics of CRAHNs make reinforcement learning (RL) techniques an attractive choice as a tool for protocol design. In this paper, we survey the state-of-the-art in the existing RL schemes that can be applied to CRAHNs, and propose modifications from the viewpoint of routing, and link layer spectrum-aware operations. We provide a framework of applying RL techniques for joint power and spectrum allocation as an example of Q-learning. Finally, through simulation study, we demonstrate the benefits of using RL schemes in dynamic spectrum conditions.",none
State scheduling method of redundant nodes in power communication network based on least square method,https://dl.acm.org/doi/10.1504/ijaacs.2022.125418,0,research-article,ACM,2022,"In order to overcome the problem of large energy consumption in traditional scheduling methods, a state scheduling method based on least square method is proposed for redundant nodes in power communication network. This method can identify and mark redundant nodes and obtain the location information of adjacent nodes in power system environment. Using the least square method and iterative method to find the location coordinates of redundant nodes in the power communication network, building the basic power communication network model, according to the work requirements of redundant nodes in the power communication network, to achieve the scheduling of redundant nodes. The experimental results show that the average energy consumption is 0.16kj less than that of the traditional method, which has better performance of coverage quality in the monitoring process and can extend the network monitoring time in the later stage of operation.",none
Computational intelligence-based energy efficient routing protocols with QoS assurance for wireless sensor networks: a survey,https://dl.acm.org/doi/10.5555/3337655.3337665,1,article,ACM,2019,"Over the decades, Wireless Sensor Networks WSNs have reached greatest heights and started to emerge into various applications, ranging from health care to multimedia transmission. In these application domains, energy efficiency and Quality of Service QoS assurance remains a challenging issue due to dynamic network conditions and resource-constrained nature of sensor nodes. This challenging issue has received considerable research attention at the network layer, which requires efficient routing protocols to meet the application-specific requirements. Therefore, WSN researchers have turned to different Computational Intelligence CI techniques in an attempt to address various routing issues in WSN. This paper presents a systematic survey on CI techniques-based routing protocols in WSN. Moreover, a comparative analysis of reviewed protocols with their strengths and limitations is also included in the survey. Finally, this paper discusses various potential directions which guide the researcher to design efficient routing protocols by combining WSN with CI techniques.",none
SECURE and energy-efficient routing protocol based on micro-segmentation and batch authentication,https://dl.acm.org/doi/10.1016/j.comnet.2024.110293,0,research-article,ACM,2024,"An effective technique in designing routing algorithms for Wireless Sensor Networks (WSNs) is named clustering nodes, which augments the network lifespan. More tasks are performed by the Cluster Heads (CHs) of the clustered WSNs, thereby consuming more energy. Hence, a secure energy-efficient Routing Protocol (RP) centered on micro-segmentation and batch authentication is proposed here. The proposed method begins by initializing the WSN nodes. After that, a random key is engendered for every node centered on their Node ID. The nodes undergo a Micro-segmentation process; in addition, they are securely grouped utilizing the Supremum Distance based K-Prototype (SD-KP) algorithm. Now, a fog layer with a number of fog nodes is initialized; also, every single micro-segmented group is assigned with an optimal fog node. Then, by using the Quasi Deterministic Sequence-Black Widow Optimization (QDS-BWO) algorithm, the optimal fog nodes are selected. By using the Root Squared- Diffie Hellman (R2-DH) technique, a key agreement is created for each group centered on their Node IDs. By using the Bitwise Cyclic Shift –BLAKE 512 (BCS-BLAKE-512) algorithm, the created keys are converted into hashcode. Now, for the purpose of performing batch authentication, the hashcode of each group is sent to the trusted authority. Subsequent to verification, data sensing occurs. Lastly, by using the Elliptic Curve Cryptography (ECC) algorithm, the data is securely encrypted and it is transmitted via the routes selected utilizing the Learned Gradient Weight Initialization-based Geography and Energy Aware Routing (LGWI-GEAR) algorithm. The proposed framework's efficacy is proved by the experimental outcomes.",none
Dynamic mobile charger scheduling with partial charging strategy for WSNs using deep-Q-networks,https://dl.acm.org/doi/10.1007/s00521-021-06146-9,6,research-article,ACM,2021,"Wireless sensor networks are a group of spatially distributed nodes deployed to sense, gather, and transmit data to the sink for further analytics. Due to continuous operations, the battery-equipped sensor nodes (SNs) drain energy rapidly, and replacing them is a hectic task. Wireless energy transfer (WET) is evolved as a promising innovation to recharge the SNs battery wirelessly to address the challenges. A WET is embedded in a vehicle called a mobile charger (MC) and traveled in the network to recharge the SNs. However, scheduling the mobile charger over the network before a sensor node dies is challenging. In this work, we introduced a partial charging strategy to avoid the long waiting time for MC because full recharging of a single node takes a long time. The partial charging strategy preempts the current charging node and moves to the newly requested node to minimize the network’s dead nodes. However, it will increase the traveling distance. Hence, adequate charging time and MC traveling path are required. In this context, this paper proposes a deep reinforcement learning-based mobile charger scheduling strategy called dynamic partial mobile charger scheduling using deep-Q-networks (DPMCS). The proposed DPMCS learns from the environment and decides each sensor’s charging duration in an identified tour. Experimental results reveal that the proposed DPMCS outperforms well compared to the existing studies, enhance the lifetime and diminish the dead nodes count.",none
A new unequal clustering protocol with local re-clustering mechanism for wireless sensor networks,https://dl.acm.org/doi/10.1504/IJCSE.2016.076935,2,article,ACM,2016,"A new unequal clustering protocol with local re-clustering mechanism is proposed to mitigate the 'hot spot' problem and thereby prolong the network lifetime of a wireless sensor network WSN. In the setup phase, the network is partitioned into several unequal-size layers based on the minimum hop count of each node to the base station BS. Then each layer is further partitioned into several layer-dependent-size clusters by a weight-based cluster head CH competition, where candidate nodes participating in CH election are selected by the BS with a new exploration approach. In addition, we propose a local re-clustering mechanism to further mitigate the uneven energy load during the data transmission phase, that is, different layers reselect their CHs at different frequencies according to their relative distances to the BS. Furthermore, for local re-clustering, a simplified CH rotation approach is proposed to lessen the communication and computation overhead. The simulation results demonstrate that our proposed protocol is effective in prolonging the network lifetime and in balancing the energy consumption.",none
QoS-based routing in Wireless Body Area Networks: a survey and taxonomy,https://dl.acm.org/doi/10.1007/s00607-017-0575-4,8,article,ACM,2018,"Wireless Body Area Network (WBAN) constitutes a set of sensor nodes responsible for monitoring human physiological activities and actions. The increasing demand for real time applications in such networks stimulates many research activities in quality-of-service (QoS) based routing for data delivery. Designing such scheme of critical events while preserving the energy efficiency is a challenging task due to the dynamic of the network topology, severe constraints on power supply and limited in computation power and communication bandwidth. The design of QoS-based routing protocols becomes an essential part of WBANs and plays an important role in the communication stacks and has significant impact on the network performance. In this paper, we classify, survey, model and compare the most relevant and recent QoS-based routing protocols proposed in the framework of WBAN. A novel taxonomy of solutions is proposed, in which the comparison is performed with respect to relevant criteria. An analytical model is proposed in order to compare the performances of all the solutions. Furthermore, we provide a study of adaptability of the surveyed protocols related to the healthcare sector.",none
A Review on Routing in Internet of Things,https://dl.acm.org/doi/10.1007/s11277-019-06853-6,8,review-article,ACM,2020,"Recently, internet of things has drawn attention among the academicians, governments and engineers from various sectors. There are many critical issues in IoT such as security, scalability, big data analytics. Availability, interoperability, performance, mobility. This paper focus on providing optimal routing among the various networking environment such as wired wireless and sensors in the IoT. In this paper the major research issues involved in the existing routing protocols to meet the requirements of internet of things are reviewed the major issues involved in the design of a routing protocol and the different classification of routing protocols are studied. The major challenges of the internet of things, must address the problem of dynamic topology, scalability, mobility of nodes and limited bandwidth. The review covers different kinds of routing protocols such as reactive, proactive, hybrid, location aware, hybrid, multicast, multipath, Geocast, power aware and hierarchical existing geometric routing protocols have been sensibly studied which involves discussion on routing techniques, the advantages and disadvantages of the existing work area analysed in order to help the future researchers. The analysis of existing routing protocols is carried out based on shortest path, least transmission time. Finally, a research open challenge in routing which needs to be addressed by the research and academic community are discussed.",none
A time-efficient convergecast scheduling on star-linear IWSN for narrow process industries,https://dl.acm.org/doi/10.1155/2015/123062,0,article,ACM,2015,"The wireless technology is regarded as a paradigm shifter in the process industry. A star-linear industry wireless sensor network (IWSN) for narrow process industries is proposed in this paper. Based on the proposed IWSN, we focus on time-efficient convergecast solutions. We present algorithms to achieve optimal convergecast performance in terms of time slots use. In the proposed IWSN, the field devices (FDs) constitute a set of TDMA (time division multiple access) based star topology clusters, and the cluster heads present a multihop linear backbone. Time slots are scarce communication resource for convergecast in a narrow IWSN. Aiming to use slots efficiently, we design optimal algorithms to improve the polling scheduling in the cluster and the packets forwarding over the backbone. In a cluster, we design a multicycle scheduling algorithm and a fair polling algorithm to improve slots utility of the communication reliability and integrity. Over the backbone, an optimal slots allocating algorithm is designed to maximize the slots performance in terms of the end-to-end communication reliability, based on which a slot-efficient multisuperframe scheduling algorithm is presented. Performance analysis and simulations show that our solution outperforms traditional ones in terms of communication reliability and real-time.",none
Reformed timeslot allocation for data intensive clustered industrial wireless sensor networks using virtual grid structure with UWB,https://dl.acm.org/doi/10.1504/ijaip.2021.116359,0,research-article,ACM,2021,"The data intensive industrial sensor networks produce excessive communication collision and introduce significant deficits. Further, a defined, appropriate scheduling methodology for transmission is desirable for mitigating the scarcity of such networks. With this declaration, here inclined a method for allocating conflict-free timeslots for transmitting the data in clustered sensor networks securing it from collision. This is lightened by partitioning the monitoring cluster regions into equal sized virtual grids and Latin square characteristics support scheduling in individual grids on ultra-wide band. This decentralised protocol follows an AODV routing and thereby each sensor is aware of the neighbouring nodes location and accepts the inherent topology changes. Moreover, the nodes that are participating in transmission remains in active state and the others become idle, thus conserving less energy. This distributed MAC scheduling method is particularly helpful in spatial usage of the communication channel for achieving scalability and efficiency and hence performance.",none
Artificial bee colony metaheuristic for energy-efficient clustering and routing in wireless sensor networks,https://dl.acm.org/doi/10.1007/s00500-016-2220-0,10,article,ACM,2017,"Swarm intelligence (SI)-based metaheuristics are well applied to solve real-time optimization problems of efficient node clustering and energy-aware data routing in wireless sensor networks. This paper presents another superior approach for these optimization problems based on an artificial bee colony metaheuristic. The proposed clustering algorithm presents an efficient cluster formation mechanism with improved cluster head selection criteria based on a multi-objective fitness function, whereas the routing algorithm is devised to consume minimum energy with least hop-count for data transmission. Extensive evaluation and comparison of the proposed approach with existing well-known SI-based algorithms demonstrate its superiority over others in terms of packet delivery ratio, average energy consumed, average throughput and network life.",none
CMML: Combined metaheuristic-machine learning for adaptable routing in clustered wireless sensor networks,https://dl.acm.org/doi/10.1016/j.asoc.2022.108477,2,research-article,ACM,2022,"Cluster-based routing is the most common routing approach to achieve energy efficiency in wireless sensor networks. However, optimal determination of cluster heads is NP-hard, which calls for heuristics or metaheuristics for obtaining a near-optimal solution. Although metaheuristics achieve better performance, they suffer from high computational time, and thus, cannot rapidly respond to routing requests. Also, a large majority of the existing routing protocols cannot easily adapt to changing network or application configurations. In this paper, a Combined model based on Metaheuristics and Machine Learning, named CMML, is proposed to support efficient and adaptable routing in clustered wireless sensor networks. In our CMML model, a multi-criteria heuristic clustering algorithm is used for clustering in which a metaheuristic (e.g., genetic algorithm) is utilized for the automatic tuning of the heuristic algorithm for each configuration separately. We repeat this process for several configurations (i.e., for different network sizes, numbers of nodes, aggregation factors, lifetime definitions, etc.). The tuned heuristic algorithm in each configuration is subsequently used for network simulation to obtain the corresponding solution. As a result, a comprehensive dataset for different configurations is derived, which is used to train a machine learning model (e.g., support vector machine). The input feature vector of a sample comprises local features (current state of a node at a round), global features (current state of the network), and application-specific features, while the output is the priority factor of each node to be selected as a cluster head. After training the CMML model, it can be applied as a quickly adaptable clustering protocol. In fact, our motivation is to utilize the generalizability of machine learning to learn the behavioral pattern of the metaheuristic algorithm in finding best routes for previous configurations. Simulation results demonstrate that the CMML model can effectively adapt with different applications, while prolonging the network lifetime based on the application requirements.Highlights•A combined metaheuristic-machine learning technique (named CMML) is presented.•The CMML considers local features, global features, and application features.•The objective function of the metaheuristic algorithm is defined based on the application specifications.•The CMML is evaluated on the test WSNs to justify the performance of the trained CMML model.•The trained CMML model can be applied for online clustering in new unseen WSNs.",none
Low-power clustering scheduling algorithm for wireless sensor nodes in the internet of things,https://dl.acm.org/doi/10.1504/ijipt.2020.106327,0,research-article,ACM,2020,"Aiming at the problems of high energy consumption and long packet forwarding time existing in the existing wireless sensor node scheduling algorithm, a low-power scheduling algorithm for wireless sensor nodes in the internet of things based on clustering power consumption balanced scheduling is proposed. In this algorithm, a distributed balancing control model is used for optimised deployment design of wireless sensor nodes and design of node transmission route of the internet of things; the full-network power consumption equalisation model is adopted for path planning of wireless sensor nodes; based on an adaptive route forwarding protocol, clustering balancing control of wireless sensor nodes is performed; the minimum power consumption load is taken as the constraint cost to perform optimised design of clustering forwarding scheduling algorithm for wireless sensor nodes in the internet of things. Simulation results show that in clustering scheduling of wireless sensor nodes in the internet of things, this method costs relatively low power consumption, provides good energy equalisation of the full network, controls the network energy efficiency well, and provides high success forwarding rate of clustering scheduling of sensor nodes and good overall network performance, it has high application advantages.",none
Fuzzy cluster-based multi-node charging strategy in mobile sensor networks,https://dl.acm.org/doi/10.1016/j.adhoc.2024.103439,0,research-article,ACM,2024,"Energy is crucial for the continuous operation of rechargeable sensor networks, and efficient energy replenishment strategies are vital for improving network performance. However, existing solutions primarily focus on stationary sensor networks, and there are fewer strategies for energy replenishment in mobile networks. Typically, a Mobile Car (MC) charges individual mobile nodes one to one. To address the mobility of sensor nodes and enhance the energy replenishment efficiency of the network, this paper proposes a fuzzy clustering-based multi-node charging strategy (MMCS) in Mobile Sensor Network (MSN). Firstly, an improved multi-factor fuzzy C-mean clustering algorithm (MFCM++) is designed to cluster nodes with similar moving directions and remaining energy. Secondly, the cuckoo search algorithm (CS) is utilized to determine the optimal charging position for each cluster based on the varying energy demand levels of mobile nodes, thereby reducing the cluster charging waiting time. Finally, a spatio-temporal factor-based cluster selection algorithm (STCS) is developed to determine the order of cluster charging and select the next cluster to be charged. Extensive simulation results demonstrate that MMCS effectively enhances network performance, reduces energy costs, and addresses the energy problem in large-scale MSNs",none
Recent Advances in Scheduling Theory and Applications in Robotics and Communications,https://dl.acm.org/doi/10.1007/978-3-030-92507-9_2,0,Article,ACM,2021,"Scheduling theory is a major field in operations research and discrete applied mathematics. This paper focuses on several recent developments in scheduling theory and a broad range of new applications – from multiagent scheduling to robots in communication networks. The survey presents a personal view on current trends, critical issues, strengths and limitations of this advantageous field.",none
Scientific Workflow Makespan Minimization in Edge Multiple Service Providers Environment,https://dl.acm.org/doi/10.1007/s11277-022-09704-z,0,research-article,ACM,2022,"The edge computing model offers an ultimate platform to support scientific and real-time workflow-based applications over the edge of the network. However, scientific workflow scheduling and execution still facing challenges such as response time management and latency time. This leads to deal with the acquisition delay of servers, deployed at the edge of a network and reduces the overall completion time of workflow. Previous studies show that existing scheduling methods consider the static performance of the server and ignore the impact of resource acquisition delay when scheduling workflow tasks. Our proposed method presented a meta-heuristic algorithm to schedule the scientific workflow and minimize the overall completion time by properly managing the acquisition and transmission delays. We carry out extensive experiments and evaluations based on commercial clouds and various scientific workflow templates. The proposed method has approximately 7.7% better performance than the baseline algorithms, particularly in overall deadline constraint that gives a success rate.",none
Machine learning and deep learning methods for wireless network applications,https://dl.acm.org/doi/10.1186/s13638-022-02196-2,0,editorial,ACM,2022,No abstract available.,none
A review of IoT network management: Current status and perspectives,https://dl.acm.org/doi/10.1016/j.jksuci.2021.03.006,3,review-article,ACM,2022,"During this last past decade, the Internet of Things (IoT) has gained much attention because it encompass intelligent devices such as smart sensors and actuators, which enable a wide range of applications that improve our daily life (e.g. smart agriculture). However, due to the presence of an important number of heterogeneous and resources constrained devices (in terms of memory, CPU and bandwidth) communicating over error-prone and lossy radio channels and often deployed in hostile environments (e.g. war zone), IoT networks are experiencing various network performance problems (e.g. excessive energy consumption resulting from network device failure). In this context, an efficient management of IoT networks is needed in order to ensure good network performances. This has fueled the development of different protocols and frameworks for management of IoT networks. In this paper we present a comprehensive study of representative works on IoT network management. The paper analyzes existing solutions for IoT low power networks management and presents a taxonomy of those solutions. Moreover, this paper also compares existing research proposals on management of IoT low power networks based on different requirements. At the end, this survey identifies remaining challenges for an efficient mangement of IoT low power networks.",none
A Novel Energy-Aware Clustering Method via Lion Pride Optimizer Algorithm (LPO) and Fuzzy Logic in Wireless Sensor Networks (WSNs),https://dl.acm.org/doi/10.1007/s11277-019-06497-6,4,research-article,ACM,2019,"Recent technological advances and developments in the field of communication information systems, especially in microelectro mechanical systems have provided the ground for the production and setup of small nodes which are supplied with batteries with limited batteries. These nodes have wireless communications with each other. A WSN includes a large number of sensor nodes which are located densely or scatteredly within a phenomenon or with a little distance from it. However, it should be noted that sensor nodes have low computational capability, little storage space and limited battery power. Due to resource limitations, a compromise should be made between processing precision and power optimization in WSNs. In this paper, using LPO algorithm and fuzzy logic, we proposed a novel energy-aware clustering method which lightweight and has relatively high precision. In the proposed method, clustering is done according to two main parameters, i.e. node’s remaining energy and distance from the sink. The results of simulating the proposed method via OPNET 11.5 revealed that the proposed method contributed to the reduction of average delay, input packet, power consumption and enhanced network lifetime.",none
