title,link,number_of_citation,article_type,publisher,publication_date,abstract,keyword
An Adaptive Fuzzy C Means with Seagull Optimization Algorithm for Analysis of WSNs in Agricultural Field with IoT,https://dl.acm.org/doi/10.1007/s11277-022-09801-z,0,research-article,ACM,2022,"In recent years, the environmental monitoring in agriculture field is an essential required application. To achieve the environmental monitoring of agriculture fields, the wireless sense networks (WSN) and internet of things is utilized. In the WSN, the energy consumption is a main issue to access the medium and transfer the networks. Hence, in this paper, adaptive fuzzy C means clustering and seagull optimization algorithm is developed for monitoring environmental conditions in agriculture field. Two main objective functions are utilized to empower the presentation of the WSN such as load balancing and energy efficient operation. The proposed method is a combination of fuzzy C means clustering and seagull optimization algorithm (SOA). The energy efficient and load balancing is achieved by optimal routing scheme by proposed method. The fuzzy C-means clustering is utilized to empower the energy efficient operation and load balancing. In the fuzzy C-means clustering, the SOA is utilized to select the optimal path selection. The proposed method is executed by NS2 simulator and performances are compared with existing methods such as atom search optimization and emperor penguin optimization respectively. The performance metrics are delay, drop, throughput, energy consumption, network lifetime, overhead and delivery ratio.",none
Multi-robot exploration in task allocation problem,https://dl.acm.org/doi/10.1007/s10489-021-02483-3,5,research-article,ACM,2022,"Task allocation is an important problem in multi-robot system which can be defined with different setup for different application, i.e. coverage, surveillance and mining mission in static or dynamic scenarios. Our focus in this paper is exploring environment to accomplish tasks distributed over the environment by minimizing overall cost of the system. This problem is defined as a NP-Hard problem, thus will be more challenging in larger environments containing many robots and tasks. To solve multi-robot task allocation in very large environment we propose a new deployment-based framework. Our proposal divided the problem into two sub-problems: region partitioning and routing problem. This decomposition eases considering our problem specification in multi-robot system which are not easily considerable in other approaches, i.e distribution of the tasks or robots’ initial position. Load balancing is done globally by deploying robots in a proper location of the environment and assigning sub-regions among them. Sub-regions contains set of points, where the goal is visiting all the points individually by one of the robots. On the other hand, after deploying the robots, routing techniques can be simply applied to find shortest and safest paths for every robots. To search for solutions in this NP-hard problem, two methods are built on a tailor-made multi-objective scheme of Genetic Algorithm (GA) with a different setup and search operators, and a reinforcement learning approach. Simulation results testify the performance of our methods in comparison to existing ones.",none
Graph Based Optimization for Multiagent Cooperation,https://dl.acm.org/doi/10.5555/3306127.3331863,0,research-article,ACM,2019,"We address the problem of solving math programs defined over a graph where nodes represent agents and edges represent interaction among agents. The objective and constraint functions of this program model the task agent team must perform and the domain constraints. In this multiagent setting, no single agent observes the complete objective and all the constraints of the program. Thus, we develop a distributed message-passing approach to solve this optimization problem. We focus on the class of graph structured linear and quadratic programs (LPs/QPs) which can model important multiagent coordination frameworks such as distributed constraint optimization (DCOP). For DCOPs, our framework models functional constraints among agents (e.g. resource, network flow constraints) in a much more tractable fashion than previous approaches. Our iterative approach has several desirable properties---it is guaranteed to find the optimal solution for LPs, converges for general cyclic graphs, and is memory efficient making it suitable for resource limited agents, and has anytime property. Empirically, our approach provides solid empirical results on several standard benchmark problems when compared against previous approaches.",none
Classification of node degree based on deep learning and routing method applied for virtual route assignment,https://dl.acm.org/doi/10.5555/3062406.3062614,3,research-article,ACM,2017,"In recent years, the importance of various wireless network technologies has increased. Specifically, in communication environments noted for severe conditions, such as disasters, war, and terrorism, collaboration between fixed communication infrastructure and wireless ad-hoc networks is indispensable. In this paper, the node degree of wireless communication is classified for disaster situations, and virtual routes are set according to the predetermined node degree. Then, the proposed routing method is employed with base stations as the infrastructure, such that a route may be assigned, maintained, and recovered. Our classification of wireless degree nodes uses deep learning, and virtual routes are created by employing the Viterbi algorithm. The proposed routing method is compared with existing methods (AODV, OLSR, and ZRP) from the viewpoint of route discovery times and reachability via simulations.",none
A review of different techniques used for routing in wireless sensor networks,https://dl.acm.org/doi/10.1504/ijaip.2024.140093,0,research-article,ACM,2024,"The aim of this paper is to summarise all information related to routing in wireless sensor networks (WSNs). The available routing techniques are divided in three ways: hierarchical, flat and location-based routing. WSNs are made of small nodes, wireless communication capabilities, and computation. Various researchers are working on the technique which can be a combination of effective routing and optimised energy consumption. From the last two decades, this has been the issue to improve the power usage of the router used in WSNs. The energy issue can be addressed by using different protocols in WSNs router. Currently, available protocols are query-based, multi-path, QoS-based, negotiation-based and coherent-based. In this paper, each routing technique is discussed in great detail with their advantages and disadvantages. Author also has highlighted the future area of research.",none
Sensor device scheduling-based cuckoo algorithm for enhancing lifetime of cluster-based wireless sensor networks,https://dl.acm.org/doi/10.1504/ijcat.2022.123231,3,research-article,ACM,2022,"This study proposes the Sensor Device Scheduling-based Cuckoo Algorithm (SeDeSCA) for enhancing the lifespan of cluster-based WSNs. SeDeSCA consists of two phases: clustering and scheduling. The WSN is clustered into clusters using the DBSCAN algorithm in the first phase. The scheduling phase is periodic and consists of three steps: cluster head polling, scheduling decision-based optimisation, and covering. The sensors in each cluster choose their cluster head, which executes the Cuckoo Algorithm (CA) to select a suitable schedule of sensors that will achieve sensing during the current period. The aim of scheduling is to minimise energy consumption and ensure sufficient coverage for the monitored area while maximising network lifespan. The third step is to cover the area of interest with the sensors that are scheduled to be active during this period. The simulation results show that SeDeSCA improves the network lifespan and coverage ratio, as well as the lifespan of WSNs.",none
Energy efficient data collection in sink-centric wireless sensor networks,https://dl.acm.org/doi/10.1016/j.comcom.2016.07.001,5,research-article,ACM,2017,"Sink-centric traffic pattern is common in wireless sensor networks (WSN), which typically causes higher energy consumption of the sensor nodes near the sink node (called hot spot problem). Clustering combined with careful traffic flow control can alleviate a hot spot by dispersing the energy burden concentration. Existing clustering schemes treat each clusters as an entity for energy efficiency optimization. We propose to group a set of clusters into cluster-rings, which is a chain of clusters that are equal distance away from the sink, and conduct energy efficiency optimization at the cluster-ring level. More specifically, we first present a novel method to compose a cluster structure. Next, we present an algorithm that gradually optimizes the traffic flow control at the cluster-ring level by using a multi-agent reinforcement learning technique. Then, we present an algorithm that makes cluster-level traffic routing decision on the basis of cluster-ring level traffic flow control results. Via simulations, it is shown that the proposed scheme result near-optimal performance and can adapt to dynamic changes of network-wide traffic generation.",none
Ant-based routing for wireless multimedia sensor networks using multiple QoS metrics,https://dl.acm.org/doi/10.1016/j.comnet.2010.05.014,36,article,ACM,2010,"In wireless sensor networks, most routing protocols consider energy savings as the main objective and assume data traffic with unconstrained delivery requirements to be a given. However, the introduction of video and imaging sensors unveils additional challenges. The transmission of video and imaging data requires both energy efficiency and QoS assurance (end-to-end delay and packet loss requirements), in order to ensure the efficient use of sensor resources as well as the integrity of the information collected. This paper presents a QoS routing model for Wireless Multimedia Sensor Networks (WMSN). Moreover, based on the traditional ant-based algorithm, an ant-based multi-QoS routing metric (AntSensNet) is proposed. The AntSensNet protocol builds a hierarchical structure on the network before choosing suitable paths to meet various QoS requirements from different kinds of traffic, thus maximizing network utilization, while improving its performance. In addition, AntSensNet is able to use a efficient multi-path video packet scheduling in order to get minimum video distortion transmission. Finally, extensive simulations are conducted to assess the effectiveness of this novel solution and a detailed discussion regarding the effects of different system parameters is provided. Compared to typical routing algorithms in sensor networks and the traditional ant-based algorithm, this new algorithm has better convergence and provides significantly better QoS for multiple types of services in wireless multimedia sensor networks.",none
Clustering for smart cities in the internet of things: a review,https://dl.acm.org/doi/10.1007/s10586-022-03646-8,5,research-article,ACM,2022,"Nowadays, internet of things (IoT) applications, especially in smart cities, are fast developing. Clustering is a promising solution for handling IoT issues such as energy efficiency, scalability, robustness, mobility, load balancing, and so on. The clustering method, which can be applied in IoT, groups sensor nodes into clusters with one node operating as the cluster head. This paper intends to determine the usage of clustering in IoT as a case study for smart cities. Furthermore, this study discusses clustering algorithms on IoT, open issues, and future challenges of clustering in the context of the smart city, and also existing research papers selected by the systematic literature review technique published between 2017 and 2021. Also, we provide a technical taxonomy for clustering categorization in IoT, which includes algorithm, architecture, and application. According to the statistical analysis of 51 chosen research articles in the domain of clustering in IoT, the results show that the number of clusters has a high percentage of 24%, the energy factor has 23%, the execution time factor has 18%, the accuracy has 14%, the delay has 9%, the lifetime has 6%, and throughput has 6%.",none
An Optimized and Energy-Efficient Ad-Hoc On-Demand Distance Vector Routing Protocol Based on Dynamic Forwarding Probability (AODVI),https://dl.acm.org/doi/10.1155/2022/5750767,0,research-article,ACM,2022,"MANET (mobile ad-hoc network) is a wireless ad-hoc network made up of mobile devices that use peer-to-peer routing to provide network access instead of using a preexisting network infrastructure. Despite the network infrastructure’s simplicity, it faces issues such as changeable connection capacity, dynamic topology, node battery power exhaustion, and inadequate physical security. Broadcasting is a standard MANET approach for sending messages from a source node to all other nodes in the network. Flooding is a frequent method for broadcasting route request (RREQ) packets, which is susceptible to broadcast storms. The high retransmission rate is caused by the standard flooding technique, which causes media congestion and packet collisions, which can drastically reduce throughput and network performance. In a mobile ad-hoc network, efficient broadcasting focuses on selecting a compact forward node set while assuring broadcast coverage. The goal is to find a limited number of forward nodes that will provide complete coverage. In this paper, we propose an optimized and energy-efficient routing protocol for MANET (mobile ad-hoc network) based on dynamic forwarding probability in general and AODV (ad hoc on-demand distance vector) in particular, in which the route request packets are randomly controlled to increase the network lifetime and reduce packet loss in the flooding algorithm. We tested and assessed the results of our proposed solution using various network performance factors after implementing and integrating it into NS-2. According to simulation findings, our proposed technique effectively reduced route request propagation messages (RREQ). The suggested technique is more efficient, has a longer network lifetime, and uniformly utilizes node residual energy, enhancing network throughput and minimizing routing overhead when compared to regular and modified AODV protocols.",none
A machine learning-based trust evaluation model for wireless sensor networks,https://dl.acm.org/doi/10.1145/3672919.3673035,0,research-article,ACM,2024,"Wireless sensor networks have been widely used in many industries, where sensor nodes are used to perform specific tasks, such as information collection or data transmission. Due to the particularity of sensor nodes, the trust mechanism of their nodes has been difficult to establish. Different from the traditional trust evaluation model, this paper proposes a trust evaluation model based on machine learning principles. By combining the extracted trust features, the final trust value is obtained for decision-making. Experimental results show that the model is effective and has higher accuracy than other methods.",none
Design and performance analysis of prime number based backoff counter adjustment (PBCA) algorithm for wireless body area networks,https://dl.acm.org/doi/10.1007/s11235-023-01050-0,0,research-article,ACM,2023,"Wireless Body Area Networks (WBANs) are critical in medical emergency services within the Internet of Things (IoT). Ensuring efficient channel utilization while avoiding collisions and optimizing route allocation is a significant research focus in this field. However, the existing CSMA/CA methods need help updating the contention window and achieving fair node distribution. This paper proposes a novel Prime number-based Backoff Counter Adjustment (PBCA) strategy to address this issue. The PBCA algorithm dynamically adjusts the contention window based on the success counter and the prime backoff stages (BS). A mathematical analysis of the proposed PBCA algorithm uses Discrete-Time Markov Chains to study its impact on saturated throughput and collision probability. The proposed algorithm simulation experiments demonstrate the superiority of the PBCA algorithm over existing approaches. The proposed strategy significantly enhances throughput, reduces packet loss and delay, and ensures the reliability of the WBAN network. Compared to existing algorithms, the PBCA algorithm optimizes 48.1% in throughput, 39.47% in packet loss, 45.11% in delay, and 78.62% in reliability. These results outstand the performance of the existing algorithms. This advancement holds promise for enhancing performance and reliability in medical emergency services within IoT applications. The future extension of this work involves integrating reinforcement learning techniques to assess network status accurately, enabling adaptive and intelligent channel allocation in wireless body area networks.",none
Enhanced network lifetime in WBAN using hybrid meta-heuristic-enabled mobile and multiple sink nodes-connected routing,https://dl.acm.org/doi/10.1504/ijmndi.2023.133239,0,research-article,ACM,2023,"Wireless body area networks (WBANs) contain many miniature sensor devices. These frameworks are constructed to transfer the sensed physiological signals continuously. It is highly complex to design a WBAN protocol with mobile and multiple sink nodes. The conventional algorithms did not fulfil the requirements of the application completely. Focusing on lower energy consumption, this paper aimed to propose an energy-aware routing protocol in WBAN by employing the mobile and multiple sink nodes. The hybridised forms of the well-efficient heuristic algorithm are developed as hybrid barnacle mating dingo optimisation (HBMDO) for optimal cluster head selection. Here, the optimal cluster heads are chosen with multi-objective constraints like distance, energy, delay, transmission load, path loss, node trust, and packet delivery ratio. The designed routing methods in WBAN thus secured efficient performance when correlated with the existing routing approaches regarding energy consumption and network lifetime.",none
MC-LMAC: A multi-channel MAC protocol for wireless sensor networks,https://dl.acm.org/doi/10.1016/j.adhoc.2010.05.003,33,article,ACM,2011,"In traditional wireless sensor network (WSN) applications, energy efficiency may be considered to be the most important concern whereas utilizing bandwidth and maximizing throughput are of secondary importance. However, recent applications, such as structural health monitoring, require high amounts of data to be collected at a faster rate. We present a multi-channel MAC protocol, MC-LMAC, designed with the objective of maximizing the throughput of WSNs by coordinating transmissions over multiple frequency channels. MC-LMAC takes advantage of interference and contention-free parallel transmissions on different channels. It is based on scheduled access which eases the coordination of nodes, dynamically switching their interfaces between channels and makes the protocol operate effectively with no collisions during peak traffic. Time is slotted and each node is assigned the control over a time slot to transmit on a particular channel. We analyze the performance of MC-LMAC with extensive simulations in Glomosim. MC-LMAC exhibits significant bandwidth utilization and high throughput while ensuring an energy-efficient operation. Moreover, MC-LMAC outperforms the contention-based multi-channel MMSN protocol, a cluster-based channel assignment method, and the single-channel CSMA in terms of data delivery ratio and throughput for high data rate, moderate-size networks of 100 nodes at different densities.",none
QFS-RPL: mobility and energy aware multi path routing protocol for the internet of mobile things data transfer infrastructures,https://dl.acm.org/doi/10.1007/s11235-023-01075-5,0,research-article,ACM,2023,"The Internet of Things (IoT) is a network of various interconnected objects capable of collecting and exchanging data without human interaction. These objects have limited processing power, storage space, memory, bandwidth and energy. Therefore, due to these limitations, data transmission and routing are challenging issues where data collection and analysis methods are essential. The Routing Protocol for Low-power and Lossy Networks (RPL) is one of the best alternatives to ensure routing in LoWPAN6 networks. However, RPL lacks scalability and basically designed for non-dynamic devices. Another drawback of the RPL protocol is the lack of load balancing support, leading to unfair distribution of traffic in the network that may decrease network efficiency. This study proposes a novel RPL-based routing protocol, QFS-RPL, using Q-learning algorithm policy and ideation from the Fisheye State Routing protocol. We have developed an algorithm for ease of data transfer in the IoT, which provides better performance than existing protocols, especially when dealing with a mobile network. To evaluate the performance of the proposed method, the Contiki operating system and Cooja simulator have been used in scenarios with mobile and stationary nodes and random network topologies. The results have been compared with RPL and mRPL. We have developed an algorithm for ease of data transfer in the IoT, which provides better performance than existing protocols, especially when dealing with a mobile network. The simulation outputs revealed that our scheme performs more efficiently in load balancing, number of table entries, Packet Delivery Ratio (PDR), End-to-End (E2E) latency, network throughput, convergence speed, control packet overhead and Remaining Useful Lifetime in designed scenarios compared to other methods. Moreover, the simulation results show an out-performance of rival schemes in terms of remaining energy and network lifetime.",none
A Survey of Data Aggregation Protocols for Energy Conservation in WSN and IoT,https://dl.acm.org/doi/10.1155/2022/8765335,0,review-article,ACM,2022,"Conservation of energy has been a major concern for Wireless Sensor Networks (WSNs) and IoT applications. Several strategies were devised, aimed at optimizing energy consumption in these applications, based on: (a) use of low-powered hardware devices, (b) deploying mobile/relay agents for data collection, (c) clustering, and (d) data aggregation. Amongst these, data aggregation is widely acknowledged as an important tool to conserve energy in WSN and IoTs. The paper provides a comprehensive survey of various data aggregation strategies, discusses the efficacy of these strategies in handling issues that are typical to WSN and IoT applications. These issues severely impact the performance metrics such as: energy efficiency, latency, fault-tolerance, network throughput, and network lifetime. Therefore, to optimize the data aggregation approach, an application developer needs to arrive at optimal tradeoffs between these parameters. A major contribution of the paper is to present a holistic review of data aggregation approaches emphasizing the effect of topology, security, mobility, interference, and fault-tolerance in WSN and IoTs. Based on gap areas in literature, we throw open few challenges and present them as “posers”, and put-forth suggestions for further research.",none
Localization and Detection of Multiple Attacks in Wireless Sensor Networks Using Artificial Neural Network,https://dl.acm.org/doi/10.1155/2023/2744706,1,research-article,ACM,2023,"Security enhancement in wireless sensor networks (WSNs) is significant in different applications. The advancement of routing attack localization is a crucial security research scenario. Various routing attacks degrade the network performance by injecting malicious nodes into wireless sensor networks. Sybil attacks are the most prominent ones generating false nodes similar to the station node. This paper proposed detection and localization against multiple attacks using security localization based on an optimized multilayer perceptron artificial neural network (MLPANN). The proposed scheme has two major part localization techniques and machine learning techniques for detection and localization WSN DoS attacks. The proposed system is implemented using MATLAB simulation and processed with the IBM SPSS toolbox and Python. The dataset is classified into training and testing using the multilayer perceptron artificial neural network to detect ten classes of attacks, including denial-of-service (DoS) attacks. Using the UNSW-NB, WSN-DS, NSL-KDD, and CICIDS2018 benchmark datasets, the results reveal that the suggested system improved with an average detection accuracy of 100%, 99.65%, 98.95%, and 99.83% for various DoS attacks. In terms of localization precision, recall, accuracy, and f-score, the suggested system outperforms state-of-the-art alternatives. Finally, simulations are done to assess how well the suggested method for detecting and localizing harmful nodes performs in terms of security. This method provides a close approximation of the unknown node position with low localization error. The simulation findings show that the proposed system is effective for the detection and secure localization of malicious attacks for scalable and hierarchically distributed wireless sensor networks. This achieved a maximum localization error of 0.49% and average localization accuracy of 99.51% using a secure and scalable design and planning approach.",none
