title,link,number_of_citation,article_type,publisher,publication_date,abstract,keyword
Reinforcement Learning-Based MAC Protocol for Underwater Multimedia Sensor Networks,https://dl.acm.org/doi/10.1145/3484201,6,research-article,ACM,2022,"High propagation delay, high error probability, floating node mobility, and low data rates are the key challenges for Underwater Wireless Multimedia Sensor Networks (UMWSNs). In this article, we propose RL-MAC, a Reinforcement Learning (RL)–based Medium Access Control (MAC) protocol for multimedia sensing in an Underwater Acoustic Network (UAN) environment. The proposed scheme uses Transmission Opportunity (TXOP) for relay nodes in a multi-hop network for improved efficiency concerning the mobility of the relays and sensor nodes. The access point (AP) and relay nodes calculate traffic demands from the initial contention of the sensor nodes. Our solution uses Q-learning to enhance the contention mechanism at the initial phase of multimedia transmission. Based on the traffic demands, RL-MAC allocates TXOP duration for the uplink multimedia reception. Further, the Structural Similarity Index Measure (SSIM) and compression techniques are used for calculating the image quality at the receiver end and reducing the image at the destination, respectively. We implement a prototype of the proposed scheme over an off-the-shelf, low-cost hardware setup. Moreover, extensive simulation over NS-3 shows a significant packet delivery ratio and throughput compared with the existing state-of-the-art.",none
A reinforcement learning-based sleep scheduling algorithm for compressive data gathering in wireless sensor networks,https://dl.acm.org/doi/10.1186/s13638-023-02237-4,2,research-article,ACM,2023,"Compressive data gathering (CDG) is an adequate method to reduce the amount of data transmission, thereby decreasing energy expenditure for wireless sensor networks (WSNs). Sleep scheduling integrated with CDG can further promote energy efficiency. Most of existing sleep scheduling methods for CDG were formulated as centralized optimization problems which introduced many extra control message exchanges. Meanwhile, a few distributed methods usually adopted stochastic decision which could not adapt to variance in residual energy of nodes. A part of nodes were prone to prematurely run out of energy. In this paper, a reinforcement learning-based sleep scheduling algorithm for CDG (RLSSA-CDG) is proposed. Active nodes selection is modeled as a finite Markov decision process. The mode-free Q learning algorithm is used to search optimal decision strategies. Residual energy of nodes and sampling uniformity are considered into the reward function of the Q learning algorithm for load balance of energy consumption and accurate data reconstruction. It is a distributed algorithm that avoids large amounts of control message exchanges. Each node takes part in one step of the decision process. Thus, computation overhead for sensor nodes is affordable. Simulation experiments are carried out on the MATLAB platform to validate the effectiveness of the proposed RLSSA-CDG against the distributed random sleep scheduling algorithm for CDG (DSSA-CDG) and the original sparse-CDG algorithm without sleep scheduling. The simulation results indicate that the proposed RLSSA-CDG outperforms the two contrast algorithms in terms of energy consumption, network lifetime, and data recovery accuracy. The proposed RLSSA-CDG reduces energy consumption by 4.64% and 42.42%, respectively, compared to the DSSA-CDG and the original sparse-CDG, prolongs life span by 57.3%, and promotes data recovery accuracy by 84.7% compared to the DSSA-CDG.",none
A hybrid model using fuzzy logic and an extreme learning machine with vector particle swarm optimization for wireless sensor network localization,https://dl.acm.org/doi/10.1016/j.asoc.2018.01.004,23,research-article,ACM,2018,"l abstractDisplay OmittedHighlights•We investigate a practical integration of soft-computing for WSN localizations.•We propose a hybrid model applying Centroid and ELM optimizations.•We optimize the hybrid model using resultant vector based on PSO.•We consider several key factors affecting the location estimation precision, i.e., node density, sensing coverage, and heterogeneous topology.AbstractLocalization is one of the challenges in wireless sensor networks, especially those without the aid of a global positioning system. Use of a dedicated positioning device incurs additional cost and reduces battery life; therefore, a range-free localization scheme is promising as a cost-effective approach. However, the main limitation of this approach is that the estimation precision can be affected by factors such as node density, sensing coverage, and topology diversity. Thus, this study investigates and proposes a method for improving a traditional range-free-based localization method (centroid) that uses soft computing approaches in a hybrid model. This model integrates a fuzzy logic system into centroid and uses an extreme learning machine (ELM) optimization technique to capitalize on the strengths of both approaches: the former is properly used with low node density and short coverage, while the latter is used for the opposite—to achieve a robust location estimation scheme. The ratios of known nodes within the sensing coverage range to the total known nodes and of the sensing coverage range to the maximum coverage range are used as adaptive weights for this hybrid model. To further improve the efficiency, especially in heterogeneous topologies, the concept of resultant force vectors is applied to this hybrid model over particle swarm optimization to mitigate the effects of irregular deployments. The performance of the proposed method is extensively evaluated via simulations that demonstrate its effectiveness compared to other state-of-the-art soft-computing-based range-free localization schemes (i.e., centroid, a fuzzy logic system, and a support vector machine with a traditional ELM).",none
Fuzzy logic optimized wireless sensor network routing protocol,https://dl.acm.org/doi/10.5555/2595812.2595814,2,article,ACM,2013,"Wireless sensor networks WSNs are used in health monitoring, tracking and security applications. Such networks transfer data from specific areas to a nominated destination. In the network, each sensor node acts as a routing element for other sensor nodes during the transmission of data. This can increase energy consumption of the sensor node. In this paper, we propose a routing protocol for improving network lifetime and performance. The proposed protocol uses type-2 fuzzy logic to minimize the effects of uncertainty produced by the environmental noise. Simulation results show that the proposed protocol performs better than a recently developed routing protocol in terms of extending network lifetime and saving energy and also reducing data packet lost.",none
An efficient routing access method based on multi-agent reinforcement learning in UWSNs,https://dl.acm.org/doi/10.1007/s11276-021-02838-1,0,research-article,ACM,2022,"A large proportion of underwater data is collected in deep sea. Compared with the direct bottom-to-surface acoustic links, underwater sensor networks (UWSNs) with hierarchical network model topology are more efficient at transmitting huge amounts of data to sea surface. Base on reinforcement learning, an adaptive modulation and coding in depth based router (MC-DBR) algorithm was proposed. The MC-DBR is designed to reduce the energy consumption, time delay etc., while improve the communication performance. In MC-DBR, each node firstly uses HELLO packets to sense the neighbouring channel states. Then, each node updates its Q-value by multi-agent reinforcement learning based modulation and coding method (MARL-MC) algorithm. The energy consumption, the time delay, the modulation and coding methods and the packets collisions etc. are considered in MARL-MC to improve the overall performance of the whole network. The convergence and computation complexity of the MC-DBR were analyzed in detail. The performance of the MC-DBR was compared with the benchmark algorithms. The results showed that the MC-DBR can obtain lower end-to-end delay, higher packet delivery rate and lower average remaining energy of the network.",none
Reinforcement Learning Based Routing in EH-WSNs with Dual Alternative Batteries,https://dl.acm.org/doi/10.1145/3404555.3404569,0,research-article,ACM,2020,"This paper considers an Energy Harvesting Wireless Sensor Network (EH-WSN) where nodes have a dual alternative battery system. We propose a stateless distributed reinforcement learning based routing algorithm, named QLRA, where each node learns the best next hop(s) to forward its data based on the battery and data information of its neighbors. We study how the number of sources and path exploration probability impacts the performance of QLRA. Numerical results show that after learning, QLRA is able to achieve minimal end-to-end delays in all tested scenarios, which is about 18% lower than the average end-to-end delay of a competing routing algorithm.",none
